source,title,content,dominant_topic,topic_probability,kmeans_cluster,word_count
VNExpress,Cựu sinh viên Bách khoa rẽ lối học Y sau 5 năm làm trưởng phòng,"Đang là trưởng phòng kinh doanh ở tuổi 27, Đào Sỹ Sơn, cựu sinh viên Đại học Bách khoa Hà Nội, quyết định theo đuổi con đường làm bác sĩ.",2,0.9492281477580137,0,19
VNExpress,Techcombank trao học bổng 1 triệu USD cho quán quân 'A.I thực chiến',"Techcombank trao học bổng du học quốc tế ""Điều kỳ diệu"" trị giá 1 triệu USD cho đội Converged, quán quân chương trình ""A.I thực chiến"" mùa đầu, tại đêm chung kết diễn ra tối 10/1.",4,0.66968631007546,0,25
VNExpress,Đầu bếp mách bí quyết làm pate kiểu Pháp trong một giờ,"Hà NộiĐầu bếp Nguyễn Văn Khu hướng dẫn cách làm pate kiểu Âu tại nhà trong khoảng một tiếng, không cần hấp, phù hợp với người bận rộn nhưng vẫn muốn tự tay làm.",0,0.9453528506605159,2,29
VNExpress,Bên trong thế giới 'trục vong' online,"MalaysiaFitri bắt đầu buổi livestream ""thanh tẩy"" cho hàng nghìn người xem với tuyên bố có thể trục xuất ""vong ám"" qua màn hình smartphone.",2,0.8992240364559558,0,17
VNExpress,Người nước ngoài: Việt Nam cuồng nhiệt với bóng đá hơn Anh,"TP HCMThấy đường phố kẹt cứng, cờ đỏ rợp trời, Paul Holland từng hoảng sợ tưởng có chuyện gì bất thường nhưng lập tức nhận ra đó là người Việt ăn mừng chiến thắng bóng đá.",1,0.9316966783730964,2,28
VNExpress,Khốn khổ vì sống chung với gấu 260 kg dưới gầm nhà,"MỹÔng Ken Johnson mất ăn mất ngủ, phải tắm nước lạnh giữa mùa đông vì con gấu nặng 260 kg chọn gầm nhà ông làm nơi trú đông suốt hai tháng.",3,0.9570996879241301,0,27
VNExpress,Vợ xin cưới bạn thân cho chồng,"MalaysiaBiết chồng nảy sinh tình cảm với bạn thân của mình, Shuhadah Jaafar, ở bang Terengganu đau khổ nhưng vẫn quyết định ra tòa xin cho anh cưới người này làm vợ hai.",4,0.9190811461858741,0,29
VNExpress,Bí quyết ướp thịt mềm ngọt không cần muối hay rượu,"Thay vì dùng muối khiến thịt mất nước hay rượu để lại mùi nồng, công thức ""nước hành gừng - bột bắp - dầu ăn"" giúp thịt xào mềm, giữ trọn vị ngọt.",2,0.9418890827581428,0,27
VNExpress,Hành trình 'lột xác' không phẫu thuật của cô gái xấu xí,"Nhật BảnKozue Sakurada dành 13 năm nghiên cứu 30.000 bức ảnh tự chụp để tìm ra phong cách phù hợp, rũ bỏ ám ảnh ""xấu xí"" đeo bám từ thời thơ ấu.",2,0.42911885687400775,0,23
VNExpress,Làn sóng thanh niên Trung Quốc xuất ngoại tìm việc làm,"Bo đã lên kế hoạch di cư suốt ba năm, dự định sang Australia làm điều dưỡng, nếu không thành công anh sẽ chuyển hướng đi Pháp.",1,0.9259326289790408,0,21
VNExpress,Bức xúc vì hàng xóm lấn chiếm hành lang chung cư,"Cầm tờ giấy xuất viện hôm 14/1, việc đầu tiên chị Hằng làm không phải về nhà nghỉ ngơi mà đi thuê một căn hộ khác để tránh xa người hàng xóm ""độc hại"".",2,0.6252232071509937,2,27
VNExpress,4 kiểu 'lệch pha' âm thầm giết chết hôn nhân,"Khủng hoảng hôn nhân thường không nổ ra ngay lập tức mà tích tụ từ những lệch pha âm thầm về vai trò, giao tiếp và sự phát triển, theo chuyên gia tâm lý Luo Mingjin.",4,0.9263660379153686,0,25
VNExpress,Hành trình thực hiện dự án 'bảo tồn nguồn nước' của Heineken Việt Nam.,"Heineken Việt Nam duy trì dự án hơn một thập kỷ, mang nước sạch đến cho 15.000 người, tạo giá trị kinh tế cho hàng trăm hộ dân, đồng thời bảo tồn nước nhiều khu vực.",0,0.7223138497424031,2,25
VNExpress,Những lầm tưởng trong chuẩn bị mâm cúng của người Việt,"Nhiều gia đình mâu thuẫn, thậm chí vay mượn tiền bạc chỉ để bày biện mâm cỗ cúng hoành tráng, với tâm lý ""cúng to mới linh"".",4,0.7297462667440654,0,19
VNExpress,Mâm cơm ấm nóng ngày đông,"Cá kho chuối, thịt gà nấu đông, đậu phụ nhồi thịt, bắp cải luộc, dưa cải muối chua là những món truyền thống cung cấp đủ dinh dưỡng, kích thích vị giác ngày lạnh.",0,0.932736573761433,0,27
VNExpress,"Cho cá ăn 5 tấn ớt mỗi ngày để 'đẹp dáng, thơm thịt'","Trung QuốcThay vì thức ăn công nghiệp, chủ một trang trại dùng hàng tấn ớt tươi mỗi ngày để nuôi đàn cá, khẳng định cách làm này giúp vật nuôi ""đẹp dáng, thơm thịt"".",0,0.6936716926738814,0,26
VNExpress,Vì sao đàn ông thường im lặng khi vợ nổi cáu?,"Sự im lặng của đàn ông khi xung đột không hẳn là vô tâm, mà thường là cơ chế phòng vệ sinh học khi não bộ bị quá tải cảm xúc.",2,0.8836833287589081,0,21
VNExpress,Vỡ mộng đổi đời bằng nghề IT,"AnhTừng vay gần 3 tỷ đồng để học lập trình với giấc mơ đổi đời, Adam, 42 tuổi, giờ đây đối mặt với khoản nợ khổng lồ và sự ghẻ lạnh của thị trường lao động.",1,0.528359468938622,2,26
VNExpress,Nỗi sợ mùa đông của người già Anh,"Vẫn đi làm 5 ngày mỗi tuần ở tuổi 82, ông Roger Cliffe-Thompson tối về chỉ dám dùng chăn điện, hứng nước tắm để xả bồn cầu vì sợ hóa đơn sưởi ấm tăng cao.",1,0.6548384679596666,0,32
VNExpress,Cả làng thành thù địch sau khi cùng trúng số độc đắc,"Tây Ban NhaTừ chỗ ôm nhau ăn mừng giải thưởng 35 triệu euro, ngôi làng Villamanín rơi vào hỗn loạn, cãi vã vì ban tổ chức bán vé ""khống"" cho 50 người.",2,0.576201537344518,0,25
VNExpress,Chàng trai Bắc Ninh chế tác ngựa khổng lồ đón Tết Bính Ngọ,"Anh Bùi Văn Quân sử dụng hàng chục tấn bêtông để tạo bộ ba linh vật ngựa cao tới 6 m phục vụ miễn phí người dân, dịp Tết Bính Ngọ 2026.",1,0.34963915811103485,0,23
VNExpress,Chương mới cuộc đời cô bé 'người sói',"MalaysiaMissclyen Roland, 5 tuổi, cô bé mắc hội chứng ""người sói"" từng được Hoàng gia nhận nuôi, bắt đầu những ngày đầu tiên ở trường mẫu giáo với nhiều cảm xúc trái chiều từ bạn bè.",2,0.4955559825008171,4,28
VNExpress,13 năm mơ ngôi trường gạch của thầy giáo cắm bản,"Lâm ĐồngNghe tiếng gió rít qua khe vách ván gỗ, thầy Trần Phi Thế ra hiệu cho học trò lớp 5C ngồi xích lại gần nhau để giữ ấm trong lớp học nằm lọt thỏm giữa rừng.",3,0.9325052990892398,0,31
VNExpress,"Càng bất an, 'chuyện ấy' càng thăng hoa","Nhiều người lầm tưởng tình dục cuồng nhiệt là dấu hiệu của hạnh phúc, song thực tế đây có thể là cơ chế phòng vệ của những người luôn lo sợ bị bỏ rơi.",2,0.8395258677292581,0,23
VNExpress,Nhiều phụ nữ Mỹ nuôi chó thay cho hẹn hò,"Mệt mỏi với các ứng dụng hẹn hò nhiều quy tắc nhưng thiếu cảm xúc, nhiều phụ nữ tại New York chọn dành thời gian bên thú cưng để tìm lại sự cân bằng.",4,0.932800222408803,0,26
VNExpress,Chị em song sinh cưới anh em sinh đôi,"Trung QuốcTại hôn lễ của chị em song sinh họ Shan và hai chú rể họ Song, khách mời thêm ngỡ ngàng khi biết bác của cả nhà trai và gái đều là các cặp sinh đôi.",2,0.9194309034544431,0,29
VNExpress,Công ty trả tiền để nhân viên đi chơi với bạn,"Thụy ĐiểnĐể nhân viên bớt cô đơn, một công ty dược phẩm cho phép họ dùng giờ làm việc để đi gặp gỡ bạn bè, đồng thời cấp thêm 100 USD tiêu vặt.",4,0.9185508963032966,0,23
VNExpress,"Nhờ dân mạng giúp mổ lợn, cô gái bất ngờ tiếp 10.000 khách","Trung QuốcLo bố mẹ già yếu không giữ nổi lợn Tết, Dai Dai lên mạng tìm người giúp đỡ nhưng không ngờ 10.000 người đã đổ về, tạo nên bữa tiệc ""ăn đụng"" chưa từng có.",0,0.8427753317518015,0,29
VNExpress,Khách Việt có thể bay thẳng Trung Quốc không cần visa,"Du khách Việt có thể bay thẳng Quế Lâm, khám phá cảnh núi non nổi tiếng Trung Quốc và không cần xin visa từ tháng 4.",1,0.9323129165651284,0,18
VNExpress,Bên trong bảo tàng phở đầu tiên của Việt Nam,Bảo tàng phở đầu tiên mở cửa đón khách tham quan với giá vé 750.000 đồng mỗi lượt gồm tìm hiểu lịch sử trăm năm của phở Việt và trải nghiệm tô phở bò đặc biệt.,0,0.6142162187125811,0,26
VNExpress,Những giờ cuối đời trong vùng chết của Everest,Hai nhà leo núi người Anh tử nạn tại 'vùng chết' của Everest khi thực hiện chuyến leo mạo hiểm không dùng bình oxy bổ sung năm 1982.,3,0.9179711601159403,2,22
VNExpress,"Viếng thiền viện trăm tuổi, tượng Phật 34 m ở Hong Kong","Hong Kong (Trung Quốc) hút khách du lịch đầu năm với thiền viện Bửu Liên 120 tuổi, tượng Phật Tian Tan, làng văn hóa.",1,0.7166127692084218,0,18
VNExpress,Tiệm mì Nhật gây tranh cãi vì cấm cửa khách Trung Quốc,"Tiệm mì ramen tại Osaka gây bức xúc khi công khai ""cấm cửa"" khách Trung Quốc, áp dụng chính sách thực đơn tiếng Anh giá cao gấp đôi so với thực đơn tiếng Nhật.",0,0.6994913150410883,0,27
VNExpress,Khách nước ngoài nhờ tìm lại địa điểm chụp ảnh 22 năm trước,"Ông Joel Carpio, du khách Australia, cựu kỹ sư xây dựng cầu Thanh Trì muốn tìm lại nhà hàng cũ, để cùng gia đình thăm lại ông từng làm việc và gắn bó với Việt Nam 22 năm trước.",0,0.9456445693367713,0,29
VNExpress,Bò tái chanh vào danh sách món dùng chanh ngon nhất thế giới,"Món duy nhất của Việt Nam, bò tái chanh, với thịt bò thái mỏng chín tái tự nhiên bằng axit của chanh, vào danh sách 83 món dùng chanh ngon nhất thế giới của Taste Atlas.",1,0.9184784982077067,3,27
VNExpress,Hàng nghìn cây phượng nhuộm vàng đường ở Bảo Lộc,"Lâm ĐồngNhiều cây phượng vàng trút lá, bung nở phủ kín nhiều con đường tại thành phố Bảo Lộc và cao nguyên Di Linh.",0,0.8846027337780242,0,19
VNExpress,Bí ẩn 400 năm ở quốc gia không có sông tự nhiên,"Bahrain, quốc đảo giàu có ở châu Á, nổi tiếng với những tòa tháp kính và các chặng đua Công thức I, lại ẩn giấu bí mật tồn tại suốt 400 năm giữa sa mạc khô cằn.",3,0.9321387966393213,3,26
VNExpress,Video hướng dẫn an toàn bay 'tình tay ba' hút hàng triệu lượt xem,"Video hướng dẫn an toàn bay theo mô tuýp tình tay ba của Philippine Airlines khiến nhiều hành khách cho biết ""coi không sót giây nào"".",4,0.9262186391765601,0,20
VNExpress,Vì sao hộ chiếu Malaysia vào top 10 quyền lực thế giới?,"Malaysia được xếp vào nhóm quốc gia có chính trị ổn định, rủi ro nhập cư thấp và thể chế tương đối minh bạch - các yếu tố quan trọng giúp hộ chiếu điểm đến xếp hạng cao.",1,0.9480910349415698,0,25
VNExpress,Tranh cãi giá vé bảo tàng Louvre tăng gần gấp rưỡi,"PhápBảo tàng Louvre điều chỉnh giá vé tăng thêm 45% đối với du khách ngoài châu Âu nhằm bổ sung nguồn thu cho công tác trùng tu và vận hành, nhưng gây ra phản ứng với công chúng và giới chuyên gia.",2,0.8291780096461272,0,29
VNExpress,Tạp chí Mỹ ca ngợi cách biến tấu cà phê của người Việt,Tạp chí National Geographic nhận định sự ra đời của cà phê trứng hay cà phê dừa minh chứng cho khả năng thích nghi cùng sức sáng tạo của người Việt.,0,0.6719840809453516,0,21
VNExpress,Chợ đêm Phú Quốc đông nghịt khách quốc tế trước ngày dừng hoạt động,"An GiangKhách quốc tế chen chân tham quan, mua sắm, trải nghiệm ẩm thực trong khu chợ kéo dài khoảng 500 m ở trung tâm Dương Đông cũ.",0,0.5904287562196364,0,17
VNExpress,Lý do hành khách thường vội vã ở sân bay,"Dù hãng bay đã phân chia theo nhóm, nhiều hành khách vẫn có thói quen vây kín cổng khởi hành hoặc chen lấn ở lối đi ngay khi máy bay vừa hạ cánh.",3,0.652064016633351,0,26
VNExpress,Bộ lạc chung sống với cá sấu như gia đình,"MaliBộ tộc Dogon, Bideyat, Kabore ở châu Phi thờ loài cá sấu hung dữ và coi những con vật này như thành viên trong gia đình.",2,0.8349823236180873,0,20
VNExpress,Khách Trung Quốc giảm 'vung tiền' mua sắm ở nước ngoài,"Thế hệ du khách Trung Quốc mới ưu tiên trải nghiệm văn hóa địa phương thay vì tập trung chi tiêu, mua sắm các mặt hàng xa xỉ hoặc tầm trung tại các cửa hàng miễn thuế quốc tế.",4,0.9188883718298453,0,22
VNExpress,Hàng nghìn du khách kẹt ở quê ông già Noel vì rét âm 37 độ C,"Hàng nghìn du khách không thể rời đi do các chuyến bay bị hủy hàng loạt trong đợt rét kỷ lục với nhiệt độ gần âm 40 độ C tại Lapland, miền bắc Phần Lan.",1,0.580677237865114,0,28
VNExpress,Quốc đảo nào ở châu Á không có sông tự nhiên?,Quốc đảo không có dòng sông vĩnh cửu vì đặc thù địa hình sa mạc cùng lượng mưa thấp khiến nước mưa không thể hình thành dòng chảy tự nhiên.,4,0.8549203554581511,0,21
VNExpress,"Khách lái môtô, drift ôtô trên sông băng Cáp Nhĩ Tân","Trung QuốcHàng nghìn du khách trong và ngoài nước đổ về sông Tùng Hoa tại Cáp Nhĩ Tân để trải nghiệm những hoạt động vui chơi, giải trí độc đáo trên mặt băng.",2,0.8031820951101627,0,25
VNExpress,Cánh đồng hoa ly nhuộm vàng ven sông Kinh Thầy,"Hải PhòngCánh đồng hoa ly rộng hàng chục ha trên bãi bồi ven sông Kinh Thầy, phường Lê Đại Hành nở rộ, trở thành điểm check in của khách trẻ.",1,0.6940507325151132,2,22
VNExpress,Hộ chiếu Việt Nam đạt thứ hạng cao nhất trong 5 năm,"Trong bảng xếp hạng hộ chiếu thế giới 2026 của Henley Passport Index, hộ chiếu Việt Nam hiện xếp thứ 86, tăng 5 bậc so với xếp hạng năm 2025, cao nhất 5 năm qua.",1,0.9464127726687026,3,24
Tuoi Tre,Tây Ninh sẽ đặt trung tâm hành chính ở đâu?,Tây Ninh sẽ đặt trung tâm hành chính ở đâu?,2,0.7970647163303455,0,7
Tuoi Tre,Công tác tuyên giáo và dân vận phải thực sự 'đi trước mở đường',Công tác tuyên giáo và dân vận phải thực sự 'đi trước mở đường',1,0.9069297233710651,0,9
Tuoi Tre,Thay áo mới đón Tết cho các 'khu đất vàng' ở TP.HCM,Thay áo mới đón Tết cho các 'khu đất vàng' ở TP.HCM,0,0.8021124034154781,4,12
Tuoi Tre,Kinh tế Việt Nam trước ngưỡng phát triển quyết định,Kinh tế Việt Nam trước ngưỡng phát triển quyết định,1,0.8845327486542244,3,6
Tuoi Tre,Để TP.HCM có 187km metro vào năm 2030,Để TP.HCM có 187km metro vào năm 2030,3,0.7974687354475696,4,7
Tuoi Tre,Bí thư Hà Nội: Công bố công khai biện pháp xử lý phạt nguội để người dân biết,Bí thư Hà Nội: Công bố công khai biện pháp xử lý phạt nguội để người dân biết,4,0.918771870568773,0,11
Tuoi Tre,Trí thức Việt xa quê đặt niềm tin vào Đại hội XIV và bước chuyển lớn của đất nước,Trí thức Việt xa quê đặt niềm tin vào Đại hội XIV và bước chuyển lớn của đất nước,0,0.5628232871350394,0,16
Tuoi Tre,"Hà Nội kiểm định chất lượng chung cư cũ ở 48 xã, phường để quyết căn nào phải phá dỡ","Hà Nội kiểm định chất lượng chung cư cũ ở 48 xã, phường để quyết căn nào phải phá dỡ",3,0.9097765026710843,0,14
Tuoi Tre,Ông nào cũng giống ông nào,Ông nào cũng giống ông nào,4,0.8392004255815493,0,6
Tuoi Tre,"Dân vùng lũ Phú Yên đi chợ 0 đồng, xách hàng trĩu tay","Dân vùng lũ Phú Yên đi chợ 0 đồng, xách hàng trĩu tay",3,0.8832250535920008,0,10
Tuoi Tre,"Về Nha Trang, thấy thương từ món ăn đến con người","Về Nha Trang, thấy thương từ món ăn đến con người",0,0.8657014591401537,0,9
Tuoi Tre,Ông Bùi Ngọc Bảo: Xăng sinh học E10 lưu thông thành E8 mà bị coi là hàng giả là bất công,Ông Bùi Ngọc Bảo: Xăng sinh học E10 lưu thông thành E8 mà bị coi là hàng giả là bất công,1,0.8354109579853939,0,17
Tuoi Tre,Giày Thượng Đình có CEO mới từ Vinaconex,Giày Thượng Đình có CEO mới từ Vinaconex,0,0.2,0,7
Tuoi Tre,"Đang ở tù, nữ chủ tịch Sông Đà 1.01 còn bị xử phạt vì từng bán 'chui' cổ phiếu","Đang ở tù, nữ chủ tịch Sông Đà 1.01 còn bị xử phạt vì từng bán 'chui' cổ phiếu",1,0.6020089358221875,0,14
Tuoi Tre,Làng nghề chổi đót Chiêm Sơn hối hả chạy đua đơn hàng cuối năm,Làng nghề chổi đót Chiêm Sơn hối hả chạy đua đơn hàng cuối năm,1,0.8378056712290844,0,11
Tuoi Tre,Hàng hóa ùn ùn cửa khẩu dịp Tết: Tỉnh Lạng Sơn đưa ra lưu ý với doanh nghiệp,Hàng hóa ùn ùn cửa khẩu dịp Tết: Tỉnh Lạng Sơn đưa ra lưu ý với doanh nghiệp,0,0.8985628602238048,0,13
Tuoi Tre,Nhiều nước 'phanh gấp' giao hàng siêu tốc,Nhiều nước 'phanh gấp' giao hàng siêu tốc,2,0.8372912325097831,0,7
Tuoi Tre,"Xuất nhập khẩu kỷ lục hơn 95 tỉ USD, kéo tăng trưởng cho 'cửa ngõ' giao thương Việt - Trung","Xuất nhập khẩu kỷ lục hơn 95 tỉ USD, kéo tăng trưởng cho 'cửa ngõ' giao thương Việt - Trung",1,0.9107033516825453,0,12
Tuoi Tre,Tăng thời gian bay đêm tại 6 sân bay dịp Tết Nguyên đán 2026,Tăng thời gian bay đêm tại 6 sân bay dịp Tết Nguyên đán 2026,3,0.7360211303056954,0,8
Tuoi Tre,"Giá vàng thế giới giảm, trong nước giảm chậm","Giá vàng thế giới giảm, trong nước giảm chậm",2,0.9184251068394927,0,8
Tuoi Tre,Doanh nghiệp hóa chất 'mắc kẹt': Sở Công Thương TP.HCM rất muốn hỗ trợ nhưng không được,Doanh nghiệp hóa chất 'mắc kẹt': Sở Công Thương TP.HCM rất muốn hỗ trợ nhưng không được,1,0.8832685553267771,4,12
Tuoi Tre,"Ngân hàng thanh lý 30 ô tô, giá khởi điểm từ 60 triệu đồng/xe","Ngân hàng thanh lý 30 ô tô, giá khởi điểm từ 60 triệu đồng/xe",2,0.6347431303166884,0,8
Tuoi Tre,Nghị sĩ Dân chủ đòi điều tra điện thoại Trump Mobile,Nghị sĩ Dân chủ đòi điều tra điện thoại Trump Mobile,0,0.7333150806226858,0,7
Tuoi Tre,"YouTube siết Shorts với trẻ em, cha mẹ có thể chặn hoàn toàn video ngắn","YouTube siết Shorts với trẻ em, cha mẹ có thể chặn hoàn toàn video ngắn",0,0.7303977350294402,0,11
Tuoi Tre,"Đại tướng Lương Tam Quang: Chuyển đổi số, Đề án 06 của công an có điểm sáng nổi bật","Đại tướng Lương Tam Quang: Chuyển đổi số, Đề án 06 của công an có điểm sáng nổi bật",1,0.8651981337525895,0,12
Tuoi Tre,Europol và Microsoft phá mạng lưới lừa đảo toàn cầu qua email,Europol và Microsoft phá mạng lưới lừa đảo toàn cầu qua email,0,0.7984602830999938,0,8
Tuoi Tre,Infographic thông tin về ứng dụng Tuyên giáo và Dân vận,Infographic thông tin về ứng dụng Tuyên giáo và Dân vận,1,0.8662389656020281,0,7
Tuoi Tre,Tổng Bí thư Tô Lâm dự khởi công xây dựng nhà máy chế tạo chip bán dẫn đầu tiên tại Việt Nam,Tổng Bí thư Tô Lâm dự khởi công xây dựng nhà máy chế tạo chip bán dẫn đầu tiên tại Việt Nam,0,0.43525696852517926,3,12
Tuoi Tre,"Google đưa AI vào Gmail: Soạn nhanh, tóm gọn, dọn sạch hộp thư","Google đưa AI vào Gmail: Soạn nhanh, tóm gọn, dọn sạch hộp thư",4,0.7979773402954361,0,12
Tuoi Tre,Thường trực Ban Bí thư Trần Cẩm Tú dự lễ ra mắt ứng dụng Tuyên giáo và Dân vận,Thường trực Ban Bí thư Trần Cẩm Tú dự lễ ra mắt ứng dụng Tuyên giáo và Dân vận,4,0.6672706591093153,0,10
Tuoi Tre,Google phát triển và sản xuất smartphone cao cấp tại Việt Nam năm 2026,Google phát triển và sản xuất smartphone cao cấp tại Việt Nam năm 2026,1,0.8392315788440075,3,9
Tuoi Tre,OpenAI bật chế độ 18+ trên ChatGPT: Làm sao bảo vệ trẻ vị thành niên?,OpenAI bật chế độ 18+ trên ChatGPT: Làm sao bảo vệ trẻ vị thành niên?,1,0.8659074590407121,0,9
Tuoi Tre,"ChatGPT bắt đầu chèn quảng cáo, OpenAI cam kết 'né' chủ đề nhạy cảm","ChatGPT bắt đầu chèn quảng cáo, OpenAI cam kết 'né' chủ đề nhạy cảm",0,0.8390307568490968,0,9
Tuoi Tre,Viettel đứng đầu tại 7 trong 10 thị trường đầu tư quốc tế,Viettel đứng đầu tại 7 trong 10 thị trường đầu tư quốc tế,4,0.8643142288626702,0,8
Tuoi Tre,Chiêu lừa đảo mới khiến người xài ứng dụng chat mất tài khoản không cần OTP,Chiêu lừa đảo mới khiến người xài ứng dụng chat mất tài khoản không cần OTP,1,0.8984013121653401,0,13
Tuoi Tre,Rosé BlackPink nói về đề cử Grammy: 'Cảm giác như tôi đang sống trong mơ',Rosé BlackPink nói về đề cử Grammy: 'Cảm giác như tôi đang sống trong mơ',4,0.8656950810058337,0,13
Tuoi Tre,Lục đục trong gia đình Beckham và chuyện thừa kế tài sản 500 triệu bảng Anh,Lục đục trong gia đình Beckham và chuyện thừa kế tài sản 500 triệu bảng Anh,0,0.8386445359444359,0,11
Tuoi Tre,"Rhyder: Em bị ngại, không giỏi nói lời yêu thương đâu","Rhyder: Em bị ngại, không giỏi nói lời yêu thương đâu",4,0.8848059465761119,0,10
Tuoi Tre,"Hồng Nhung, Thanh Lam nhận giải Sol vàng của Hội Nhạc sĩ Việt Nam, Soobin là ca sĩ xuất sắc","Hồng Nhung, Thanh Lam nhận giải Sol vàng của Hội Nhạc sĩ Việt Nam, Soobin là ca sĩ xuất sắc",1,0.9101798018176174,3,15
Tuoi Tre,Liên hoan phim châu Á Đà Nẵng 2026 trở lại với quy mô toàn diện hơn,Liên hoan phim châu Á Đà Nẵng 2026 trở lại với quy mô toàn diện hơn,1,0.8659802694217359,3,9
Tuoi Tre,"Đăng Dương, Vũ Thắng Lợi, Anh Tú 'Voi Bản Đôn' hát giữa cờ hoa ở Nhà hát Hồ Gươm, mừng Đại hội Đảng","Đăng Dương, Vũ Thắng Lợi, Anh Tú 'Voi Bản Đôn' hát giữa cờ hoa ở Nhà hát Hồ Gươm, mừng Đại hội Đảng",2,0.6365517905346917,0,15
Tuoi Tre,"Phương Anh Đào cảm ơn Trấn Thành giúp cô xuất hiện lộng lẫy, yêu kiều nhất","Phương Anh Đào cảm ơn Trấn Thành giúp cô xuất hiện lộng lẫy, yêu kiều nhất",0,0.9101431594074468,0,11
Tuoi Tre,Hoài Linh vẫn mãi là ông già nông dân rặc Nam Bộ,Hoài Linh vẫn mãi là ông già nông dân rặc Nam Bộ,3,0.7314379691397854,0,8
Tuoi Tre,"Tối nay, Mưa đỏ chiếu sớm trên kênh Truyền hình Quốc phòng lúc mấy giờ?","Tối nay, Mưa đỏ chiếu sớm trên kênh Truyền hình Quốc phòng lúc mấy giờ?",1,0.8976784510943911,0,11
Tuoi Tre,My Hero Academia được fan Hàn bầu là Anime của năm,My Hero Academia được fan Hàn bầu là Anime của năm,4,0.5999562216796259,0,10
Tuoi Tre,Bầu Đức thưởng 1 tỉ đồng và hứa tặng thêm 2 tỉ cho U23 Việt Nam nếu thắng bán kết,Bầu Đức thưởng 1 tỉ đồng và hứa tặng thêm 2 tỉ cho U23 Việt Nam nếu thắng bán kết,1,0.9262853881521116,3,17
Tuoi Tre,"Báo Bola ca ngợi Việt Nam kiên trì đi đến thành công, là 'cú tát' cho bóng đá Indonesia","Báo Bola ca ngợi Việt Nam kiên trì đi đến thành công, là 'cú tát' cho bóng đá Indonesia",1,0.7429417153876098,3,14
Tuoi Tre,"Cả ngày hạnh phúc ngất ngây của cổ động viên U23 Việt Nam, khen đội tuyển tài năng, khỏe, đẹp","Cả ngày hạnh phúc ngất ngây của cổ động viên U23 Việt Nam, khen đội tuyển tài năng, khỏe, đẹp",1,0.5536963437182079,3,13
Tuoi Tre,Vòng lặp chán chường của Man United,Vòng lặp chán chường của Man United,2,0.7328303609648664,0,6
Tuoi Tre,Đình Bắc nén đau thi đấu từ vòng bảng U23 châu Á 2026,Đình Bắc nén đau thi đấu từ vòng bảng U23 châu Á 2026,1,0.8989594213691415,3,9
Tuoi Tre,U23 Việt Nam không được AFC thưởng ngay cả khi vô địch châu Á,U23 Việt Nam không được AFC thưởng ngay cả khi vô địch châu Á,1,0.8653580432494089,3,10
