source,title,content,dominant_topic,topic_probability,kmeans_cluster,word_count
VNExpress,Hệ thống giải golf quốc gia năm 2026,"Năm nay, Hiệp hội golf Việt Nam (VGA) sẽ tổ chức tổng cộng 23 giải đấu trên ba cấp độ chuyên môn cho nam và nữ, với lịch trình từ tháng 3 đến tháng 12.",1,0.8987341700481197,3,25
VNExpress,Vietravel đưa người hâm mộ Việt đến World Cup 2026,"Vietravel trở thành đại lý tại Việt Nam của On Location - đơn vị cung cấp dịch vụ tiếp đón của FIFA, đưa người hâm mộ theo dõi các trận đấu với nhiều trải ...",0,0.5098856484356398,3,24
VNExpress,Man City mua được tuyển thủ Anh với 'giá hời',"Man City đạt thỏa thuận tuyển mộ Marc Guehi với giá 27 triệu USD, 6 tháng trước khi trung vệ tuyển Anh hết hạn hợp đồng với Crystal Palace.",2,0.9263077096354858,0,23
VNExpress,Quả đá luân lưu hiếm thấy ở tứ kết U23 châu Á 2026,"Arab SaudiSự chủ quan của thủ môn Jordan khiến bóng đi vào lưới trong loạt luân lưu, nơi Nhật Bản thắng 4-2 tại tứ kết U23 châu Á 2026 tối 16/1.",1,0.5473359145547677,3,22
VNExpress,"Việt Nam hạ UAE, vào bán kết U23 châu Á","Arab SaudiHòa ở hai hiệp chính, Việt Nam thắng UAE 3-2 sau hai hiệp phụ trận tứ kết U23 châu Á 2026.",1,0.9199435820169471,3,15
VNExpress,LĐBĐ Malaysia tính thay toàn bộ ban chấp hành để tránh bị FIFA đình chỉ,LĐBĐ Malaysia (FAM) đang tìm mọi cách tái cơ cấu để không bị FIFA đình chỉ hoạt động sau vụ làm giả hồ sơ 7 cầu thủ nhập tịch.,3,0.8976947844278598,0,21
VNExpress,HLV PSG muốn bóng đá dùng thẻ xanh như bóng bầu dục,"HLV trưởng PSG Luis Enrique hoan nghênh ý tưởng áp dụng cơ chế rút thẻ xanh trong bóng bầu dục vào bóng đá, theo đó các cầu thủ sẽ phải tạm thời rời sân sau ...",2,0.9329635535954329,0,26
VNExpress,Nhật Bản thắng Jordan nhờ luân lưu ở tứ kết U23 châu Á,"Arab SaudiNhật Bản vất vả hòa Jordan 1-1 qua 120 phút, rồi thắng luân lưu 4-2 ở trận tứ kết đầu tiên của vòng chung kết U23 châu Á 2026.",1,0.7063083182436294,3,19
VNExpress,Việt Nam - UAE: Viết tiếp kỳ tích ở U23 châu Á 2026,Arab SaudiUAE được đánh giá là đối thủ vừa sức để thầy trò HLV Kim Sang-sik tiếp tục hành trình ấn tượng tại vòng chung kết U23 châu Á 2026.,1,0.6680671748110316,3,19
VNExpress,Bộ trưởng Nguyễn Mạnh Hùng: 'Tài sản lớn nhất của startup là tìm được vấn đề',"Khó cạnh tranh với nước ngoài về vốn, nhân lực hay công nghệ, ""cửa"" cho startup Việt, theo Bộ trưởng Nguyễn Mạnh Hùng, là tìm vấn đề đủ lớn, đủ khó của xã hội và đổi mới sáng tạo để giải quyết.",0,0.9551170215776175,0,31
VNExpress,Giải pháp lọc nước hydrogen ion kiềm từ máy lọc nước Hòa Phát,"Máy lọc nước Hòa Phát HyperS HPA885 ứng dụng công nghệ điện phân đa tầng, mang đến nguồn nước hàm lượng hydrogen 880-1800 ppb, hướng tới lối sống lành mạnh cho gia đình Việt.",4,0.9491936126324033,0,27
VNExpress,"Đầu tư, lướt sóng bất động sản tăng trở lại","Nhu cầu mua bất động sản để ở và tích sản có xu hướng giảm, trong khi hoạt động đầu tư, lướt sóng ngắn hạn tăng trở lại.",2,0.9105559183910912,0,19
VNExpress,FLC tiếp tục làm dự án sân golf hơn nghìn tỷ ở Gia Lai,Gia LaiCông ty con của Tập đoàn FLC được duyệt là nhà đầu tư dự án sân golf Đak Đoa hơn 1.000 tỷ đồng sau 5 năm đình trệ.,2,0.8854526269135604,2,21
VNExpress,"Hạ tầng hàng không, giao thông mở hướng phát triển cho Đông Anh","Cảng hàng không quốc tế Gia Bình cùng các trục giao thông mới tạo lực đẩy cho khu Đông Bắc Hà Nội, trong đó Cổ Loa (Đông Anh) là điểm kết nối giữa sân bay, đô thị mới và nội đô.",3,0.9485350425565108,0,29
VNExpress,Đề xuất cho bán 'nhà trên giấy' dù đang thế chấp ngân hàng,"HoREA đề xuất cho phép chủ đầu tư bán, cho thuê mua nhà hình thành trong tương lai dù đang thế chấp, chưa giải chấp ngay nếu ngân hàng và người mua đồng ý.",2,0.7533917829896611,2,25
VNExpress,FLC muốn hồi sinh dự án hơn 2.300 tỷ đồng dở dang,Tập đoàn FLC đề xuất tỉnh Thanh Hóa cho chuyển đổi dự án khu công nghiệp Hoàng Long hơn 2.300 tỷ đồng dang dở thành khu đô thị để phù hợp quy hoạch mới.,2,0.9491770672251798,2,22
VNExpress,Hà Nội giao 4 ha đất xây nhà liền kề ở gần dự án Olympic,Gần 4 ha đất tại huyện Thường Tín (cũ) được giao cho công ty thành viên của HDMon Holdings để làm dự án nhà liền kề.,4,0.4483124169629419,2,21
VNExpress,Vì sao nhiều dự án bất động sản nghỉ dưỡng 'chết yểu'?,"Thiếu tiêu chuẩn vận hành, lệch định vị sản phẩm, tiếp cận thị trường theo tư duy bán nhà ở khiến nhiều dự án bất động sản nghỉ dưỡng thất bại, theo chuyên gia.",4,0.9406459706064043,2,21
VNExpress,"1,6 tỷ đồng cải tạo căn hộ 140 m2 bằng vật liệu độc bản","Hà NộiCăn hộ được cải tạo bằng việc khai thác vật liệu mới lạ làm ngôn ngữ thiết kế chủ đạo, tạo trải nghiệm sống liền mạch và có chiều sâu.",4,0.9187721602426133,0,22
VNExpress,Tập đoàn T&T đề xuất nghiên cứu đầu tư loạt dự án tại Lâm Đồng,"Tập đoàn T&T Group kiến nghị nghiên cứu các phương án đầu tư tại Lâm Đồng, tập trung vào bất động sản, năng lượng tái tạo và nông nghiệp công nghệ cao.",2,0.5665689758510154,0,18
VNExpress,"Bình Sơn Ocean Park bổ sung nguồn liền kề, shophouse ven biển","Khánh HòaBình Sơn Ocean Park mang đến nhiều căn liền kề shophouse ven biển trong tổng thể đô thị hoàn thiện hạ tầng, tập trung vào chức năng thương mại, dịch vụ, cư trú tại Nam Khánh Hòa.",4,0.9380324815682562,0,26
VNExpress,Masterise Homes ra mắt 7 tòa căn hộ mới tại Ocean Park 2,"Masterise Homes phát triển dự án Masteri Grand Coast gồm 7 tòa tháp cao 27 tầng tại Ocean Park 2, hướng đến không gian sống khoáng đạt với hệ tiện ích cảnh quan liên hoàn.",4,0.9187985037302285,2,23
VNExpress,SJ Group thi công đồng thời nhà ở và hạ tầng tại Vista Nam An Khánh,"Hà NộiDự án Vista Nam An Khánh được SJ Group triển khai xây dựng đồng thời hạng mục nhà ở và hệ thống hạ tầng giao thông, cảnh quan nội khu.",0,0.9373475951640808,2,21
VNExpress,Lợi thế thương mại của nhà phố hai mặt tiền Vinhomes Royal Island,Nhà phố hai mặt tiền Vinhomes Royal Island đáp ứng nhu cầu vừa ở vừa kinh doanh nhờ thiết kế hai mặt tiền và hưởng lợi từ hạ tầng đồng bộ của khu vực.,0,0.92603467716106,2,25
VNExpress,Landmark 35 phát triển căn hộ đa dạng diện tích,"Landmark 35 tại phường Hồng Gai, Quảng Ninh phát triển bộ sưu tập căn hộ từ studio đến bốn phòng ngủ, đáp ứng nhu cầu ở thực và nâng cao chất lượng sống cho cư dân trung tâm.",3,0.7051576906092818,0,27
VNExpress,Eco Retreat ra mắt phân khu lễ hội 71 ha,"Tây NinhDự án Eco Retreat 220 ha ra mắt phân khu mới với tên gọi ""Mùa Lễ Hội"", tập trung các hoạt động thương mại, dịch vụ, sự kiện cộng đồng.",4,0.5420973502481912,0,20
VNExpress,Bảng giá đất mới tại Hưng Yên có nơi tăng hơn 10 lần,"Bảng giá đất ở của Hưng Yên áp dụng từ 1/1 tăng tại hầu hết khu vực, nhiều nơi cao hơn 8-10 lần.",1,0.76392848580536,0,17
VNExpress,Đồng Nai khởi công hai dự án nhà ở xã hội từ 450 triệu đồng một căn,"Hai dự án nhà ở xã hội rộng 2,1 ha và 3,7 ha được xây dựng ở xã Phước An đáp ứng gần 8.500 hộ dân, giá rẻ nhất 450 triệu đồng một căn.",3,0.7821698649869163,2,25
VNExpress,Gia Lai đấu giá khu đô thị 200 ha tại Pleiku,"UBND tỉnh Gia Lai vừa quyết định đấu giá quyền sử dụng đất để thực hiện dự án khu đô thị CK54 tại phường Pleiku, với giá khởi điểm hơn 2.247 tỷ đồng.",4,0.9590842677991668,2,24
VNExpress,Môi giới tháo chạy khỏi khu vực sốt đất đấu giá,"Nghệ AnMôi giới, nhà đầu tư lần lượt rút khỏi xã Đại Huệ, thị trường nhanh chóng hạ nhiệt, sau khi có thông tin cho thấy các chính quyền thận trọng với đề xuất làm khu công nghiệp.",2,0.9460954678425402,2,26
VNExpress,Không gian sống cho ba thế hệ lấy cảm hứng từ nếp nhà xưa,"Hải PhòngVượt khỏi công năng để ở, công trình chú trọng kết nối con người với thiên nhiên và ký ức, tạo nên không gian sống an yên, bền vững.",0,0.9183084000582152,0,19
VNExpress,Sun Group ra mắt đảo Nam tại đô thị Charmora City,"Đảo Nam thuộc đô thị Charmora City do Sun Property phát triển hướng đến mô hình an cư sinh thái, gắn với không gian sống chăm sóc sức khỏe.",1,0.9488792909724982,0,20
VNExpress,"Chính sách cam kết tiền thuê 1,6 tỷ đồng trong hai năm tại Bạch Đằng 1288","Hải PhòngChủ đầu tư dự án Bạch Đằng 1288 công bố chính sách cam kết tiền thuê 9% giá bán trong hai năm cho các căn shophouse, với tổng giá trị khoảng 1,6 tỷ đồng mỗi căn.",0,0.6325562639987262,2,25
VNExpress,Huế đấu giá khu đất gần đồi Vọng Cảnh làm khu nghỉ dưỡng sinh thái,"Khu đất gần 7 ha cạnh lăng Tự Đức và đồi Vọng Cảnh được TP Huế đấu giá quyền sử dụng đất 50 năm để làm khu nghỉ dưỡng, mức khởi điểm 194 tỷ đồng.",4,0.9594902218752044,2,26
VNExpress,Hải Phòng có thêm dự án nhà xã hội gần 20 triệu một m2,"Dự án nhà xã hội tại xã Mao Điền, TP Hải Phòng sẽ có giá tạm tính 19,7 triệu đồng một m2, nhận đăng ký mua từ cuối tháng này.",3,0.7474937436828126,2,23
VNExpress,CBRE: Hơn 34.000 căn hộ dự kiến chào bán tại TP HCM năm nay,"TP HCM năm 2026 dự kiến đón hơn 34.000 căn hộ, tăng gần gấp đôi so với năm trước, trong đó khu vực nội thành dự kiến đóng góp khoảng 15.000 căn, theo CBRE.",1,0.6340253116416349,2,25
VNExpress,Hơn 1.400 ha đất tại dự án khu đô thị Đại Ninh bị thu hồi,Lâm ĐồngToàn bộ 1.428 ha đất đã giao Công ty Sài Gòn Đại Ninh để làm khu đô thị sinh thái được tỉnh thu hồi từ ngày 13/1.,4,0.9268243060912373,2,19
VNExpress,"Nam công nhân gục xuống, ngừng tim khi đang may","TP HCMNgười bệnh nam 26 tuổi đang làm việc với máy may thì bất ngờ quỵ xuống, ngừng tim nghi do điện giật, được bác sĩ cấp cứu kịp thời và thoát cửa tử.",2,0.6335165929179154,2,24
VNExpress,Bác sĩ Trung Quốc hướng dẫn 2 thói quen cải thiện chức năng thận sau 3 tháng,Bác sĩ Hung Yung-hsiang hướng dẫn bệnh nhân suy thận mạn cải thiện sức khỏe bằng cách uống nước theo trọng lượng cơ thể và tập thể dục vừa sức mỗi ngày.,0,0.5895476806228107,0,23
VNExpress,Người đàn ông tử vong sau 4 tháng bị chó cắn,"Lào CaiSau 4 tháng bị chó cắn vào ngón chân của bàn chân phải, người đàn ông ở Hợp Thành tử vong với dấu hiệu bệnh dại.",2,0.5284174360183146,0,21
VNExpress,"Tăng gần 30 kg, tưởng béo phì hóa ra suy thận giai đoạn cuối","Trung QuốcCơ thể tăng vọt từ 51 kg lên 80 kg trong vài tháng, Xiao Ran, 24 tuổi, ngỡ mình béo phì do ăn uống nhưng thực chất mắc hội chứng ure huyết.",1,0.9316592925741226,0,26
VNExpress,Siêu đầu bếp Gordon Ramsay 'chỉ ăn 2 miếng' để duy trì thể trạng khỏe mạnh,"AnhDù luôn phải tiếp xúc với những món ăn thượng hạng, Gordon Ramsay vẫn duy trì được hình thể săn chắc sau khi giảm 19 kg, nhờ thực đơn cân bằng, kỷ luật trong tập luyện và nguyên tắc ""chỉ ăn 2 miếng"".",2,0.9521934500697844,0,32
VNExpress,Ba bệnh viện lớn ở Cần Thơ hợp tác điều trị ung thư,"Ba bệnh viện Ung bướu TP Cần Thơ, Đa khoa TP Cần Thơ và Quân y 121 ký kết hợp tác điều trị ung thư khu vực miền Tây, hạn chế chuyển tuyến lên TP HCM.",3,0.9422120033145523,2,24
VNExpress,Stress khiến nhiều đàn ông 'bất lực',"Áp lực kinh tế, công việc và biến cố gia đình khiến nhiều nam giới rơi vào trạng thái căng thẳng kéo dài, gây suy giảm testosterone, dẫn đến rối loạn cương dương và mất ham muốn tình dục.",0,0.9259710006154495,0,25
VNExpress,Ăn trứng thường xuyên tốt cho não bộ thế nào,Một đánh giá hệ thống mới đây chỉ ra rằng ăn từ 3 đến 7 quả trứng mỗi tuần có thể là chìa khóa giúp duy trì sự minh mẫn và ngăn ngừa sa sút trí tuệ khi về già.,0,0.7489969529669755,0,29
VNExpress,5 món ăn giàu magie giúp ngủ ngon giấc,"Ăn quả bơ, chuối, mè đen, khoai lang thường xuyên cung cấp magie, giúp cơ thể thư giãn và dễ đi vào giấc ngủ sâu.",0,0.9191545669126205,0,19
VNExpress,Mổ nội soi - kỹ thuật chiếm ưu thế trong điều trị phụ khoa,"Hơn 75% bệnh nhân phụ khoa tại Bệnh viện Từ Dũ TP HCM được phẫu thuật nội soi giúp hồi phục nhanh, xuất viện chỉ sau 2-3 ngày thay vì chịu đau đớn và nằm viện dài ngày như mổ hở.",3,0.9253265418130129,2,30
VNExpress,Hội chứng Lemierre,"Hội chứng Lemierre xảy ra khi nhiễm trùng do vi khuẩn lan vào các mô và không gian sâu bên trong cổ, hình thành cục máu đông trong tĩnh mạch cảnh.",4,0.9421654970819161,0,25
VNExpress,Ngồi nhiều gây yếu sinh lý?,"Nhiều người nói nam giới ngồi nhiều, lười vận động gây hại sức khỏe sinh sản, yếu sinh lý, điều này đúng không?(Tùng, 25 tuổi, Hà Nội).",1,0.9320789710117244,0,20
VNExpress,Biến chứng khi cắt bao quy đầu không đúng cách,"Sẹo xấu, co kéo, nhiễm trùng, lây bệnh truyền nhiễm... có thể xảy ra khi nam giới cắt bao quy đầu sai cách.",0,0.8990412300531538,0,17
VNExpress,Đau nhức xương khớp có nên xoa dầu nóng?,"Khi đau nhức xương khớp, tôi thường xoa bóp dầu nóng, có lúc giảm đau có lúc không. Dùng dầu nóng thường xuyên có an toàn? (Mỹ Ngọc, Tiền Giang)",2,0.957482858286318,0,25
VNExpress,Vi khuẩn xâm nhập máu tấn công tinh hoàn người đàn ông,"TP HCMAnh Tuấn, 35 tuổi, đau sưng tinh hoàn, xét nghiệm ghi nhận nhiễm vi khuẩn Klebsiella pneumoniae.",1,0.5818088437736698,2,12
VNExpress,Mẹo ăn thịt nướng giảm nguy cơ ung thư,"Ướp thịt với các loại thảo mộc, luộc hoặc chần sơ trước khi nướng và kiểm soát nhiệt độ hợp lý có thể giảm nguy cơ hình thành các chất gây ung thư.",0,0.9269391562681226,0,24
VNExpress,6 dấu hiệu ung thư họng thường gặp,"Ung thư họng có thể gây mảng trắng hoặc loét lâu lành, khối u ở cổ, cảm giác nghẹn, khàn tiếng và các bất thường ở lưỡi.",0,0.899392080635849,0,20
VNExpress,Ô nhiễm không khí có làm hen phế quản nặng hơn?,"Tôi bị hen phế quản nhiều năm nay, gần đây ho nhiều hơn vào những ngày không khí ô nhiễm, hít phải bụi mịn, khói bụi. Môi trường có làm bệnh nặng hơn không? (Trần Mai, Hà Nội)",3,0.37668503199593784,0,32
VNExpress,Uống gì giàu sắt tốt cho phụ nữ?,"Nước ép táo, mận, sinh tố hạt bí ngô, rau chân vịt giàu sắt giúp cung cấp năng lượng, hỗ trợ cân bằng hormone cho phụ nữ.",4,0.9186457123535413,0,18
VNExpress,Điều gì xảy ra với đường huyết khi uống trà bạc hà?,"Trà bạc hà không trực tiếp làm giảm đường huyết nhưng có thể hỗ trợ ổn định chỉ số này nhờ cung cấp nước, giảm căng thẳng và cải thiện chất lượng giấc ngủ.",0,0.8529425187214893,0,22
VNExpress,5 món chống viêm giúp ngủ ngon nên ăn mỗi tuần,"Một số loại quả mọng, rau củ, cá béo giúp giảm tình trạng viêm gây khó chịu và đau nhức, tránh gián đoạn giấc ngủ.",0,0.9266765787789737,0,19
VNExpress,5 loại vitamin cần thiết cho phụ nữ tuổi 40,"Bổ sung các loại vitamin A, C, D, E, vitamin nhóm B giúp bảo vệ sức khỏe xương, ổn định nội tiết tố cho phụ nữ.",1,0.9268531817382026,0,18
VNExpress,Xăm môi có lây viêm gan B không?,"Tôi định xăm môi hồng, nhưng nghe nói dụng cụ xăm có thể lây viêm gan B và các bệnh khác, làm sao để phòng bệnh? (Thúy Hoàng, 35 tuổi, Hà Nội)",4,0.8986643859143407,0,22
VNExpress,Tăng men gan do đột biến gene gây ứ sắt,"Hà NộiBà Mai, 62 tuổi, men gan luôn cao gấp 3-4 lần bình thường không rõ nguyên nhân, nay xét nghiệm di truyền xác định đột biến gene gây ứ sắt.",1,0.9099161332953198,0,22
VNExpress,Vì sao phẫu thuật ung thư phổi?,"Phẫu thuật có thể loại bỏ triệt căn khối u ung thư phổi, tăng cơ hội sống cho người bệnh, giảm nguy cơ tái phát.",0,0.7493969594247128,0,15
VNExpress,Làm gì giúp trẻ ít ốm vặt khi trời lạnh?,"Trời lạnh, con tôi hay ốm vặt, uống thuốc bớt rồi lại ho, sốt, sổ mũi, lâu khỏi bệnh. Chăm sóc, tăng cường sức đề kháng cho con thế nào? (Minh Anh, TP HCM)",2,0.6626189679228318,2,28
VNExpress,Lương tân cử nhân Đại học Kinh tế TP HCM trên 9 triệu đồng,"97% sinh viên Đại học Kinh tế TP HCM có việc trong vòng một năm sau khi tốt nghiệp, đa số làm ở khối tư nhân với lương tháng trên 9 triệu đồng.",2,0.5275088754750673,2,25
VNExpress,Chủ nhân Nobel Vật lý giảng bài cho học sinh Việt Nam,"Giảng bài về sóng hấp dẫn, GS Takaaki Kajita, chủ nhân Giải Nobel Vật lý 2015, giúp nhiều học sinh hiểu hơn nghiên cứu khoa học và cách kết nối để tham gia vào các dự án lớn.",2,0.6191041779751965,0,28
VNExpress,Học viện Kỹ thuật quân sự dự kiến tuyển hệ dân sự ngành Kỹ thuật ôtô,"Học viện Kỹ thuật quân sự (MTA) dự kiến tăng 120 chỉ tiêu hệ dân sự so với năm ngoái, tuyển mới hai chương trình đào tạo là Điện tử Y sinh và Kỹ thuật ôtô.",1,0.9422981351094748,0,23
VNExpress,Trường học 114 tỷ đồng dở dang suốt 8 năm ở TP HCM,"Trường THCS Hiệp Bình Phước xây năm 2018, xong phần thô rồi bỏ hoang đến nay, trong khi nhiều trường học chật vật xoay xở vì thiếu phòng, cơ sở vật chất xuống cấp.",3,0.9324373515678614,4,24
VNExpress,27 học sinh giải vàng cuộc thi nhạc cụ lớn nhất Hà Nội,Hà Nội27 học sinh giành huy chương vàng trong lần đầu Liên hoan nhạc cụ được tổ chức ở bậc học phổ thông.,2,0.8992139633545567,0,16
VNExpress,Du học sinh Việt vi phạm thị thực ở Hàn Quốc tăng vọt,"Cứ 10 du học sinh ở lại trái phép hoặc làm quá giờ quy định ở Hàn Quốc thì có 7-9 người Việt, tăng vọt trong 10 năm qua.",0,0.8989797909083614,0,21
VNExpress,Sơn La rút phương án thi lớp 10 với tổ hợp 6 môn,"Dù đánh giá thi tổ hợp vào lớp 10 là cần thiết, Sở Giáo dục Sơn La rút lại đề xuất do ""chưa nhận được đồng thuận"" của xã hội.",2,0.5586515112748451,2,20
VNExpress,VinFast cùng 30 trường chuẩn hóa chương trình đào tạo kỹ sư ôtô điện,"VinFast hợp tác với 30 trường đại học, cao đẳng chuyên ngành kỹ thuật nhằm chuẩn hóa chương trình, giáo trình trong lĩnh vực sản xuất và sửa chữa ô tô điện.",2,0.9378486123799522,4,19
VNExpress,"Người mẹ 'sững người' khi hỏi con lý do chỉ được 9,75 điểm Toán","Nhận tin con đạt 9,75 điểm Toán, thay vì khen ngợi, chị Tú hỏi ngay về 0,25 điểm bị mất, câu trả lời của con gái khiến chị ""sững người""",2,0.9425049716130944,0,24
VNExpress,Đồng tiền nào ở châu Á có giá trị thấp nhất thế giới so với USD?,"Một đơn vị tiền tệ nước này chỉ đổi được 0,000011 USD, là đồng tiền yếu nhất thế giới, theo Forbes.",1,0.6452793137555377,0,15
VNExpress,Nhiều nhân viên trường học nguy cơ mất việc,"Nghệ AnSau nhiều năm làm hợp đồng, 5 nhân viên trường học ở xã Lam Thành mất việc, do vướng mắc kinh phí sau khi chuyển từ cấp huyện về xã.",3,0.9193551185173396,0,24
VNExpress,Đề tham khảo thi đánh giá năng lực Đại học Sư phạm Hà Nội,Trường Đại học Sư phạm Hà Nội (HNUE) công bố đề tham khảo và đáp án 12 môn thi đánh giá năng lực SPT năm 2026 để thí sinh ôn tập.,2,0.9578519711202922,4,19
VNExpress,"Trường quốc tế học phí 1,1 tỷ đồng bị đình chỉ tuyển sinh","Hải PhòngTrường Quốc tế Shattuck-St. Mary's Việt Nam - được quảng cáo dạy theo tiêu chuẩn Mỹ, học phí lên tới 1,1 tỷ đồng, phải dừng tuyển sinh vì chưa được cấp phép.",4,0.44159209916051656,3,24
VNExpress,Chàng trai Việt ở Apple chinh phục Đại học Harvard,"Từng nhận hàng trăm lá thư từ chối, Trần Tùng Anh không ngờ có ngày vừa làm việc ở Apple, vừa trúng tuyển chương trình thạc sĩ tại đại học danh tiếng hàng đầu Mỹ.",2,0.9492426745917893,0,26
VNExpress,Ai là phụ nữ quyền lực nhất thế giới?,"Tính cả năm 2025, bà đã bốn lần liên tiếp dẫn đầu top 100 ""phụ nữ quyền lực nhất thế giới"". Bà là ai?",1,0.9422698472350485,0,17
VNExpress,Đại học Công nghiệp Hà Nội thêm 5 tổ hợp mới,"Năm 2026, Đại học Công nghiệp Hà Nội (HaUI) mở mới ngành về trí tuệ nhân tạo, vi mạch bán dẫn, tăng 5 tổ hợp có Văn, Toán, Vật lý.",2,0.942608593288103,4,18
VNExpress,'Thủ khoa' bỏ lỡ giấc mơ Harvard vì quên đọc email,"Hyosang, 23 tuổi, ngỡ ngàng vì phát hiện mình đã bỏ lỡ thư báo trúng tuyển của Đại học Harvard - ngôi trường mơ ước, suốt 6 năm.",4,0.7268200571983074,4,20
VNExpress,"Trường khen top 10 học sinh đi học sớm, gây 'bão' mạng","Hải PhòngBài đăng khen 10 học sinh đi học sớm nhất, gọi các em là những ""chiến binh bình minh"" của trường THPT Hàng Hải thu hút hàng triệu lượt xem và tương tác.",2,0.8486331640800127,4,26
VNExpress,"ĐH Giao thông vận tải siết xét học bạ, bỏ quy đổi IELTS","Trường Đại học Giao thông vận tải (UTC) đưa ra mức sàn về điểm thi tốt nghiệp THPT để xét học bạ, không quy đổi IELTS từ 5.0 mà chỉ cộng điểm ưu tiên.",2,0.6607141581466361,4,25
VNExpress,Siết điểm cộng IELTS để tránh 'một thành tích tính hai lần',"Nhiều trường ủng hộ siết điểm cộng với chứng chỉ ngoại ngữ như IELTS, tránh việc ""một thành tích được tính hai lần"" - vừa quy đổi, vừa cộng điểm.",0,0.6467618781633673,0,24
VNExpress,Nước nào có thành phố đắt đỏ nhất Đông Nam Á?,"Không tính tiền thuê nhà, phí sinh hoạt ở thành phố này là khoảng 30,3 triệu đồng một người mỗi tháng, đắt đỏ nhất châu Á.",0,0.7974780317364559,2,20
VNExpress,Đại học Công nghệ Kỹ thuật TP HCM chủ yếu xét tuyển kết hợp,"Trường Đại học Công nghệ Kỹ thuật TP HCM (HCMUTE) chủ yếu xét kết hợp điểm thi tốt nghiệp THPT, đánh giá năng lực, học bạ thay vì xét riêng như trước.",2,0.8303375551589788,4,22
VNExpress,10 điểm đến du học đang lên ngoài 'bộ tứ',"Trong khi bốn cường quốc Mỹ, Anh, Canada, Australia siết chặt quy định với du học sinh, nhiều điểm đến khác như Đức, Pháp hay Hàn Quốc đang nổi lên nhờ học phí thấp và chính sách cởi mở.",0,0.5855290009563988,0,30
VNExpress,Đại học Sư phạm Hà Nội công bố ba phương thức xét tuyển,"Năm 2026, trường Đại học Sư phạm Hà Nội (HNUE) mở 8 ngành mới, áp dụng ba phương thức xét tuyển, trong đó điều chỉnh loạt tổ hợp xét bằng điểm thi SPT.",2,0.9617923942934411,4,23
