source,title,content,dominant_topic,topic_probability,kmeans_cluster,word_count
VNExpress,"Chợ Bến Thành, Hồ Con Rùa sẽ được chỉnh trang trước Tết","Chợ Bến Thành, Hồ Con Rùa, Ngã 6 Phù Đổng và nhiều tuyến đường ở khu vực trung tâm sẽ được sơn mới, chỉnh trang, tạo diện mạo mới trước Tết.",0,0.9376395335809279,0,25
VNExpress,Đề xuất luật hóa Ngày Văn hóa Việt Nam thành ngày nghỉ lễ,"Cục Việc làm đề xuất bổ sung Ngày Văn hóa Việt Nam 24/11 thành ngày nghỉ lễ khi sửa Bộ luật Lao động, người lao động sẽ được nghỉ hưởng nguyên lương.",1,0.9417938497081673,3,22
VNExpress,"Tông xe liên hoàn trên cao tốc, một người chết","Nghệ AnCú tông liên hoàn giữa 5 ôtô chạy cùng chiều khiến một người tử vong, cao tốc Nghi Sơn - Diễn Châu ùn tắc hơn 5 tiếng, rạng sáng 17/1.",3,0.9268290787833233,0,20
VNExpress,"Xe khách lao xuống cống, ba người tử vong","Xe khách 36 chỗ chở 18 người chạy quốc lộ 6 hướng Hà Nội - Sơn La, đến xã Chiềng Hặc lao xuống cống thoát nước, làm ba người chết, một người bị thương.",3,0.9495500298557885,0,24
VNExpress,"Biển người ở Hà Nội, TP HCM mừng Việt Nam vào bán kết U23 châu Á","Dù trận đấu Việt Nam – UAE kết thúc vào rạng sáng, người dân Hà Nội và TP HCM vẫn mang cờ đỏ sao vàng đổ về trung tâm ăn mừng đội tuyển lần thứ hai vào bán kết U23 châu Á.",1,0.5705382689998962,3,30
VNExpress,45 ngày chiến dịch Quang Trung thần tốc xây nhà cho dân vùng lũ,"Chiến dịch Quang Trung xây mới nhà bị đổ sập, sửa chữa nhà hư hỏng cho người dân miền Trung bị ảnh hưởng mưa bão đã hoàn thành sau 45 ngày thi công thần tốc.",3,0.9331407409553687,2,23
VNExpress,"Metro Nhổn - ga Hà Nội áp dụng vé định danh, xác thực điện tử","Từ ngày 1/2, tuyến đường sắt đô thị Nhổn - ga Hà Nội sẽ áp dụng cổng soát vé định danh, xác thực điện tử và nhận diện sinh trắc học.",2,0.9196027292500829,0,20
VNExpress,Cầu thứ 7 qua sông Trà Khúc sắp thông xe,"Quảng NgãiCầu và đường thuộc Đập dâng sông Trà Khúc dài 1,4 km, dự kiến thông xe trước Tết Bính Ngọ, là công trình đường bộ thứ 7 qua sông.",0,0.9522814610584891,0,22
VNExpress,Hơn một triệu người TP HCM cần nhà ở xã hội trong 5 năm tới,"Trong một triệu người cần nhà ở xã hội, công nhân chiếm 30%, còn lại cán bộ, công chức, viên chức và tập trung nhiều nhất khu vực TP HCM cũ.",3,0.9496908214391886,2,22
VNExpress,Ông Trần Sỹ Thanh và nhiều Bộ trưởng được giới thiệu ứng cử đại biểu Quốc hội khóa 16,"Chủ nhiệm Ủy ban Kiểm tra Trung ương Trần Sỹ Thanh và Bộ trưởng Tài chính, Nông nghiệp và Môi trường... được cử tri nơi công tác giới thiệu ứng cử đại biểu Quốc hội khóa 16, với tỷ lệ tán thành tuyệt đối.",3,0.8638920238223502,1,25
VNExpress,Tăng thời gian bay đêm tại 6 sân bay dịp Tết,"Cục Hàng không Việt Nam vừa điều chỉnh phương án khai thác bay đêm tại 6 sân bay gồm Thọ Xuân, Đồng Hới, Chu Lai, Pleiku, Tuy Hòa và Phù Cát.",3,0.935650246215568,3,21
VNExpress,Loạt trụ điện giữa đường mới mở rộng ở nội đô TP HCM,"Đường Chu Văn An (phường Bình Thạnh) mở rộng gấp 4 lần, song không thể thông xe do vướng loạt trụ điện, chủ đầu tư chưa chốt phương án di dời.",2,0.7489682641860483,0,22
VNExpress,Nhà máy ở Đồng Tháp sẽ thưởng 1.000 chỉ vàng cho công nhân,"1.000 lao động thâm niên làm việc tại Công ty TNHH Dụ Đức Việt Nam, khu công nghiệp Tân Hương (Tiền Giang cũ), được tặng mỗi người một chỉ vàng 18k.",0,0.9414377548910887,3,21
VNExpress,Hà Nội bắt đầu xử phạt vi phạm trật tự đô thị qua camera AI,"Không chỉ “phạt nguội” trong lĩnh vực trật tự an toàn giao thông, Công an TP Hà Nội mở rộng hệ thống camera AI để xử phạt các hành vi vi phạm trật tự đô thị.",4,0.957555765556623,0,22
VNExpress,Thủ tướng: Chiến dịch Quang Trung chiến thắng giòn giã,"Lãnh đạo Chính phủ khẳng định chiến dịch Quang Trung xây mới, sửa nhà cho người dân bị ảnh hưởng bởi thiên tai, đến nay đã chiến thắng giòn giã.",4,0.5881037048771428,2,19
VNExpress,Ra mắt ứng dụng Tuyên giáo và Dân vận,"Ứng dụng Tuyên giáo và Dân vận trên điện thoại thông minh nhằm tuyên truyền chính sách, chủ trương của Đảng và hỗ trợ chính quyền nắm bắt kịp thời dư luận xã hội.",1,0.9455630241098801,0,20
VNExpress,"Cháy ở chung cư 5 tầng, hai người được giải cứu","Nghệ AnLửa bùng lên tại phòng ngủ căn hộ tầng 2 chung cư Tân Hợp, phường Trường Vinh, khiến nhiều người tháo chạy, hai nạn nhân được cứu, sáng 16/1.",3,0.9266749405470234,0,22
VNExpress,Xuất hiện bão gần Biển Đông,"Ngoài khơi Philippines đang xuất hiện cơn bão mạnh cấp 8, tên quốc tế là Nokaen, khả năng không đi vào Biển Đông và không ảnh hưởng đến Việt Nam.",4,0.7196179267730639,3,24
VNExpress,Thêm 7 km đường trục phía Nam Hà Nội chuẩn bị thông xe,"Đường trục phía Nam dài hơn 40 km, chuẩn bị thông xe thêm 7 km, giúp kết nối trung tâm Hà Nội với các xã phía Nam và tỉnh Ninh Bình.",2,0.9647761773462061,0,24
VNExpress,5 năm an sinh tăng tốc từ nâng lương đến miễn học phí,"Tổng chi an sinh xã hội giai đoạn 2021-2025 vượt 1,1 triệu tỷ đồng, kéo tỷ lệ nghèo đa chiều xuống khoảng 1,3% và mở rộng miễn học phí, hướng tới khám sức khỏe định kỳ miễn phí.",1,0.9547224754810255,2,24
VNExpress,Đề xuất hơn 17.000 tỷ đồng xây Tổ hợp công nghiệp đường sắt,"Tổng công ty Đường sắt Việt Nam đề xuất đầu tư 17.286 tỷ đồng xây Tổ hợp công nghiệp đường sắt rộng 250 ha tại Hà Nội, hướng tới tự chủ sản xuất thiết bị, linh kiện cho các dự án mới.",2,0.7195690083109381,2,25
VNExpress,Cà Mau xem xét dự án dẫn nước thô từ sông Hậu hơn 5.300 tỷ đồng,"Tỉnh Cà Mau xem xét đề xuất dự án dẫn nước thô từ thượng nguồn sông Hậu, tổng vốn hơn 5.300 tỷ đồng, nhằm thay thế dần nguồn nước ngầm đang suy giảm.",0,0.9417341042265656,2,24
VNExpress,Thủ phủ công nghiệp FDI Bắc Ninh khát lao động có tay nghề,"Suốt một tháng nay, bà Nguyễn Phương Thảo, giám đốc nhân sự một doanh nghiệp sản xuất pin ở Bắc Ninh, đôn đáo tìm kiếm 150 lao động kỹ thuật, nhưng chỉ tuyển được 60 người.",1,0.9193745023663356,0,23
VNExpress,Hà Nội bàn liên kết Vùng Thủ đô theo mô hình chùm đô thị hướng tâm,"Ban Thường vụ Thành ủy Hà Nội làm việc với các tỉnh, thành phố Vùng Thủ đô về Quy hoạch tổng thể tầm nhìn 100 năm, trong đó xác lập mô hình “chùm đô thị hướng tâm”, chiều 15/1.",2,0.9407358328210231,0,25
VNExpress,Nhiều Bộ trưởng được giới thiệu ứng cử đại biểu Quốc hội khóa 16,"Bộ trưởng Lê Hoài Trung, Nguyễn Kim Sơn, Đỗ Thanh Bình được giới thiệu ứng cử đại biểu Quốc hội khóa 16 với tỷ lệ tán thành tuyệt đối từ cử tri nơi công tác.",3,0.9578322506608539,1,20
VNExpress,"Kết nối hơn 400 trạm giám sát, tiếp nhận thông tin cháy trên toàn quốc","Cục PCCC&CNCH ra mắt Trung tâm Thông tin Chỉ huy kết nối hệ thống truyền tin, báo sự cố cháy của 34 tỉnh thành, với hơn 400 trạm giám sát, tiếp nhận thông tin.",4,0.9526372885856939,0,21
VNExpress,Mỹ cảnh báo Canada vì nhập xe điện Trung Quốc,"Quan chức Mỹ cho rằng Canada sẽ ""hối hận"" với quyết định cho nhập khẩu tới 49.000 xe điện Trung Quốc, theo thỏa thuận thương mại mới với Bắc Kinh.",4,0.9101280679462673,0,20
VNExpress,Sếp Unilever: Chúng tôi xem trồng 1 triệu cây xanh là khoản đầu tư chiến lược,"Theo Unilever Việt Nam, trồng 1 triệu cây xanh giúp chống biến đổi khí hậu, vừa là khoản đầu tư bảo vệ chuỗi giá trị và sức bền cho doanh nghiệp.",1,0.5834311775188993,3,21
VNExpress,Chủ tịch Chứng khoán FPT từ nhiệm,"Do dành phần lớn thời gian sinh sống và làm việc ở nước ngoài, ông Nguyễn Văn Dũng xin từ nhiệm chức Chủ tịch Chứng khoán FPT.",4,0.9196314034887482,0,17
VNExpress,MB vươn lên dẫn đầu tăng trưởng tài sản trong nhóm Big 5,"Tăng trưởng tín dụng ổn định, tỷ lệ CASA cao và lợi thế chi phí vốn thấp giúp Ngân hàng Quân đội (MB) vươn lên dẫn đầu nhóm Big 5 về tốc độ tăng trưởng tài sản.",1,0.9461599313519328,0,24
VNExpress,MSB hợp tác Ksher cung cấp giải pháp thanh toán xuyên biên giới,MSB và Công ty TNHH Ksher (Hongkong) ký hợp tác phát triển các giải pháp thanh toán xuyên biên giới và hỗ trợ doanh nghiệp kinh doanh thương mại điện tử quốc tế tại Việt Nam tối ưu dòng tiền.,4,0.8096579136080786,3,25
VNExpress,Nhà máy Omoda & Jaecoo sắp vận hành tại Việt Nam,"Omoda & Jaecoo tăng tuyển dụng nhân lực, chuẩn bị vận hành nhà máy ôtô Trung Quốc đầu tiên tại Việt Nam.",2,0.5146598042231739,3,13
VNExpress,Thủ tướng yêu cầu ra mắt Trung tâm tài chính tại TP HCM trước 9/2,Thủ tướng Phạm Minh Chính yêu cầu ra mắt chính thức Trung tâm tài chính quốc tế tại Việt Nam ở TP HCM chậm nhất đến 9/2.,3,0.9570483451513748,2,17
VNExpress,Hàn Quốc chi 8 triệu USD biến rơm rạ Cần Thơ thành dầu sinh học,"Dự án biến rơm rạ thành dầu sinh học có thể sản xuất 17.400 tấn biodiesel từ vùng trồng 144 km2 một năm, giảm phát thải 51.000 tấn CO2, đang trong giai đoạn báo cáo thí nghiệm.",3,0.9182872941222231,2,24
VNExpress,Nhà đầu tư cá nhân rót tiền kỷ lục vào bạc,Đà tăng giá của kim loại quý khiến nhà đầu tư nhỏ lẻ đổ hơn 900 triệu USD vào các quỹ ETF bạc chỉ trong một tháng.,2,0.8650327332892379,0,21
VNExpress,Đề xuất làm kho khí thiên nhiên hóa lỏng gần 4.000 tỷ đồng ở Dung Quất,"Quảng NgãiChủ kho cảng LNG Cái Mép muốn làm cảng, trạm và kho 3.769 tỷ đồng ở Dung Quất, để sản xuất kinh doanh khí và điện, hơi nước.",0,0.918663927116329,2,23
VNExpress,Tiền vào chứng khoán giảm sâu,"VN-Index hồi phục sau hai phiên điều chỉnh liên tiếp, nhưng thanh khoản thị trường giảm sâu xuống dưới 35.000 tỷ đồng bởi tâm lý thận trọng.",2,0.925898698089051,2,19
VNExpress,Hanoi Metro lãi năm thứ 4 liên tiếp,"Năm 2025, Công ty Hanoi Metro vận hành 2 tuyến đường sắt đô thị tại Thủ đô lãi hơn 22 tỷ đồng.",2,0.9266977820287224,2,14
VNExpress,Mỹ đạt thỏa thuận thương mại với Đài Loan,"Đài Loan (Trung Quốc) sẽ đầu tư khoảng 250 tỷ USD vào Mỹ, để được giảm thuế từ 20% xuống 15% với nhiều sản phẩm xuất khẩu sang đây.",4,0.9318844585130649,0,22
VNExpress,Vietinbank muốn thoái hết vốn tại Cảng Sài Gòn,"Sau phiên đấu giá bất thành vào cuối năm ngoái, Vietinbank lên kế hoạch bán gần 20 triệu cổ phiếu đang sở hữu tại Cảng Sài Gòn bằng phương thức khớp lệnh.",1,0.9525564156482863,0,23
VNExpress,'Không đặt nặng xử phạt hộ kinh doanh giai đoạn đầu kê khai thuế',"Ông Mai Sơn, Phó cục trưởng Cục Thuế, cho biết ngành thuế ưu tiên hỗ trợ, nhắc nhở hộ kinh doanh chuyển từ thuế khoán sang kê khai thay vì kiểm tra và xử phạt trong giai đoạn đầu.",4,0.9677021232698237,0,29
VNExpress,"'Startup Việt cần thị trường thử nghiệm, không chỉ vốn'","Cục trưởng Khởi nghiệp và Doanh nghiệp công nghệ cho rằng startup không chỉ cần vốn, mà còn cần môi trường thử nghiệm, được hỗ trợ bởi các doanh nghiệp lớn.",1,0.949368499096169,0,22
VNExpress,Chủ Thép Pomina bán cổ phiếu để trả nợ sau 9 phiên tăng trần,"Cổ đông lớn nhất của Thép Pomina liên quan Chủ tịch Đỗ Duy Thái muốn bán 7,5 triệu cổ phiếu để trả nợ thay công ty, sau 9 phiên tăng trần.",0,0.9451322805948985,0,23
VNExpress,DNSE tăng doanh thu 77% năm 2025,"Kết thúc năm 2025, DNSE ghi nhận doanh thu hơn 1.467 tỷ đồng, tăng 77% so với năm trước, lợi nhuận sau thuế đạt 272,5 tỷ đồng, tăng 50%, vượt mục tiêu kinh doanh đặt ra từ đầu năm.",2,0.9522038356864871,2,28
VNExpress,BIDV hỗ trợ hộ kinh doanh làm quen với các quy định thuế mới,"Trước yêu cầu thuế mới, BIDV đã triển khai nhiều chiến dịch, cử cán bộ nhân viên xuống địa bàn hướng dẫn hộ kinh doanh sử dụng tính năng MyShop Pro để quản lý dòng tiền và tuân thủ quy định thuế.",4,0.7347261559223398,2,28
VNExpress,Tập đoàn bán dẫn hàng đầu thế giới muốn mở rộng chuỗi cung ứng tại Việt Nam,"ASML - tập đoàn bán dẫn hàng đầu thế giới - muốn mở rộng chuỗi cung ứng, sẵn sàng trở thành một phần của ngành công nghiệp bán dẫn Việt Nam.",1,0.9422119022387299,3,18
VNExpress,Bà Đặng Huỳnh Ức My: 'Bình đẳng giới là chọn đúng người đúng việc',"Không ưu tiên nam - nữ, bình đẳng giới là ""chọn đúng người đúng việc"", theo bà Đặng Huỳnh Ức My, Chủ tịch AgriS.",4,0.9104215749390477,0,17
VNExpress,Cựu chủ tịch Eximbank làm sếp Chứng khoán Bảo Minh,Cựu chủ tịch Eximbank Lương Thị Cẩm Tú làm chủ tịch công ty chứng khoán Bảo Minh từ ngày 10/1.,4,0.866317178495589,0,12
VNExpress,Mỹ có thể đã bán lô dầu Venezuela đầu tiên,"Ngày 14/1, một quan chức Mỹ cho biết trên CNN rằng nước này đã bán lô dầu Venezuela đầu tiên với giá 500 triệu USD.",2,0.9422091271520735,0,19
VNExpress,"Shopee, TikTok Shop chiếm 8% thị phần ngành bán lẻ","Năm 2025, doanh số giao dịch trên Shopee, TikTok Shop hơn 400.000 tỷ đồng, xấp xỉ 8% quy mô ngành bán lẻ.",1,0.8646519706972382,2,14
VNExpress,"Xuất khẩu rau quả sang Trung Quốc cao kỷ lục gần 5,5 tỷ USD","Xuất khẩu rau quả sang Trung Quốc năm 2025 cao kỷ lục, chiếm gần hai phần ba kim ngạch toàn ngành, khẳng định vai trò thị trường dẫn đầu của nông sản Việt Nam.",1,0.9423387629384563,3,20
VNExpress,VN-Index giảm sâu,"Áp lực xả hàng các mã vốn hóa lớn khiến VN-Index mất gần 30 điểm, thủng hàng loạt mốc quan trọng dù số lượng cổ phiếu tăng điểm chiếm ưu thế.",1,0.9494305914720019,0,24
VNExpress,10 năm gắn bó của Tóc Tiên - Hoàng Touliver,"Ly hôn sau một thập niên yêu, ca sĩ Tóc Tiên và nhà sản xuất âm nhạc Hoàng Touliver dành cho nhau sự biết ơn, trân trọng quá khứ.",4,0.9108836072269736,0,18
VNExpress,Gu mặc đời thường của hậu vệ Phạm Minh Phúc,"Minh Phúc - chân sút ghi bàn quyết định giúp Việt Nam vào bán kết U23 châu Á - thường diện hoodie, áo họa tiết khi dạo phố, du lịch.",1,0.9329631971908249,3,18
VNExpress,Tóc Tiên ly hôn,"Ca sĩ Tóc Tiên, 37 tuổi và nhà sản xuất âm nhạc Hoàng Touliver, 39 tuổi, ly hôn sau 10 năm bên nhau.",4,0.9198004751259063,0,13
VNExpress,"Sở thích chơi trống, nghe rock của Thủ tướng Nhật",Bà Sanae Takaichi - nữ Thủ tướng đầu tiên của Nhật Bản - từng chơi trống trong ban nhạc heavy metal thời sinh viên và là fan nhóm Black Sabbath.,2,0.945650817765071,0,23
VNExpress,Chương trình nghệ thuật về lịch sử phát triển của Đảng,"Hà NộiCa sĩ Đăng Dương, Anh Tú hát những ca khúc về tình cảm của nhân dân với đất nước, trong chương trình nghệ thuật tối 16/1.",2,0.8358786471292753,0,17
VNExpress,Sao nhí Hollywood gây chú ý với kiểu tạo dáng,"Duke McCloud - bảy tuổi, đóng series ""All Her Fault"" - gây chú ý với khán giả khi diện vest, tạo dáng kiểu ""6 7"" trên TikTok.",1,0.9104162409550113,0,20
VNExpress,Ngọc Huyền - 'hotgirl sư phạm' thành diễn viên triển vọng,"Nguyễn Hoàng Ngọc Huyền, 29 tuổi, nữ chính ''Cha tôi người ở lại'', nuôi ước mơ làm giáo viên trước khi rẽ hướng đóng phim.",0,0.9182002601465533,0,19
VNExpress,Những trang phục gây tranh cãi của Lisa,"Váy hở lưng lộ nội y, áo hoodie đánh lừa thị giác của Lisa khiến người khen, kẻ chê về ranh giới của sự táo bạo.",2,0.7974265151491355,0,19
VNExpress,Hòa Minzy áp lực khi làm concert đầu tay,"Ca sĩ Hòa Minzy cho biết mất ngủ khi chuẩn bị cho concert cá nhân đầu tiên, dự kiến hút gần 8.000 khán giả.",1,0.909697808771398,0,15
VNExpress,Gu diện áo dài của Hoa hậu Trương Hồ Phương Nga,"Người đẹp Trương Hồ Phương Nga thường chọn áo dài lụa, đính họa tiết hoa khi dự sự kiện, livestream bán hàng.",2,0.9263578030827871,0,17
VNExpress,Fan quyên tiền giúp Lý Á Bằng trả nợ,"Khán giả quyên 8,5 triệu nhân dân tệ (hơn 32 tỷ đồng) sau một ngày, giúp tài tử Trung Quốc Lý Á Bằng trả nợ tiền thuê mặt bằng.",2,0.909765064848083,2,19
VNExpress,Hậu trường Tả Đại Bân đóng Quan Âm Bồ Tát trong 'Tây du ký',"Diễn viên Trung Quốc Tả Đại Bân từng bị phản đối đóng Quan Âm trong ""Tây du ký"" 1982 vì ""gương mặt già"".",1,0.8845255674448848,0,15
VNExpress,Phương Anh Đào chọn kỹ kịch bản để tránh gây nhàm chán,"Diễn viên Phương Anh Đào cho biết hai năm mới đóng một phim, chọn kỹ kịch bản để tạo khác biệt, tránh gây nhàm chán cho khán giả.",0,0.9460219771476184,0,23
VNExpress,Tranh của đại thi hào Tagore lập kỷ lục đấu giá,"Bức tranh ""From Across the Dark"" của đại thi hào Ấn Độ Tagore được bán với giá 1,2 triệu USD, trở thành tác phẩm hội họa đắt nhất của ông.",1,0.60068076850838,0,24
VNExpress,Hôn nhân đồng điệu của Jennifer Lawrence,"Jennifer Lawrence học cách sống ngăn nắp vì chồng - giám đốc Cooke Maroney - thích sự trật tự, còn anh chấp nhận vợ thi thoảng trễ giờ.",4,0.9259630087942863,0,20
VNExpress,Đoàn phim Bollywood ghi hình ở Hạ Long,"Gần 100 người thuộc êkíp phim ""Silaa"" của Ấn Độ ghi hình tại vịnh Hạ Long (Quảng Ninh) và Tam Chúc, Tràng An (Ninh Bình).",1,0.8991135950057675,0,18
VNExpress,7 kiểu quần hot 2026,"Quần phồng, quần cạp trễ, quần lụa nằm trong nhóm thiết kế được lăng xê mạnh năm nay.",3,0.838956399502086,0,13
VNExpress,10 diễn viên tạo doanh thu phòng vé cao nhất Hollywood,"Zoe Saldaña - đóng ""Avatar 3"" - vượt Scarlett Johansson để là diễn viên góp phần mang lại doanh thu phòng vé cao nhất Hollywood với gần 15,5 tỷ USD.",1,0.9376203093106386,0,23
VNExpress,Giải mã tủ đồ xanh lam của Thủ tướng Nhật Bản,Thủ tướng Nhật Bản Sanae Takaichi thường diện màu xanh lam theo văn hóa truyền thống và cầu may mắn.,0,0.926755177427453,0,13
VNExpress,"Sách lý giải chuyện tên đệm 'nam Văn, nữ Thị'","Nhà nghiên cứu Trần Quang Đức lý giải nguồn gốc việc đặt đệm ''Thị'' giữa họ và tên cho phụ nữ Việt, mẹo đặt tên xấu để được khỏe mạnh, trong sách nghiên cứu.",2,0.5020119264828771,0,25
VNExpress,Ejae - thực tập sinh Kpop bị chối bỏ thành hiện tượng toàn cầu,"Ca sĩ Ejae 10 năm luyện tập vì giấc mơ idol Kpop nhưng không thành, từng nghĩ bản thân không giỏi trước khi tỏa sáng với bản hit ""Golden"".",1,0.9324000565642383,0,25
VNExpress,'Mưa đỏ' đoạt giải Cánh Diều Vàng,"Hà Nội""Mưa đỏ"" - phim lấy cảm hứng từ cuộc chiến tại thành cổ Quảng Trị - đoạt giải Cánh Diều Vàng ""Phim điện ảnh xuất sắc"".",1,0.9496237984005791,0,20
VNExpress,Nghệ sĩ hội ngộ trên thảm đỏ giải Cánh Diều,"Hà NộiDiễn viên Thu Hà, vợ chồng Tiến Luật - Thu Trang, Việt Hương - Hoài Phương góp mặt ở lễ trao giải Cánh Diều, tối 15/1.",4,0.8388075267710797,0,15
VNExpress,"HLV Kim Sang-sik: 'Chúng tôi sẽ cố gắng, dù nhớ phở lắm rồi'","Arab SaudiTrước buổi tập chiều 17/1, HLV Kim Sang-sik cùng các cầu thủ Việt Nam bày tỏ quyết tâm, hướng đến mục tiêu chinh phục đỉnh cao U23 châu Á 2026.",1,0.709137751238449,3,19
VNExpress,Trận thắng UAE có thể thay đổi quan niệm về lối đá của Việt Nam,"Việt Nam từng chỉ có thể chơi phòng ngự - phản công, xù xì gai góc trước các đội bóng lớn. Nhưng điều đó có thể được nhìn nhận lại sau khi thầy trò Kim Sang-sik thắng UAE ở tứ kết U23 châu Á 2026.",1,0.9553094849125793,3,31
VNExpress,Giải U23 châu Á 2026 không có tiền thưởng,"Giải đấu đang diễn ra ở Arab Saudi không có tiền thưởng, như nhiều giải trẻ khác thuộc Liên đoàn bóng đá châu Á (AFC).",1,0.9381792875294014,3,22
VNExpress,"HLV Thái Lan mừng vì tránh Việt Nam, Indonesia ở vòng bảng ASEAN Cup","HLV Anthony Hudson thừa nhận Thái Lan rơi vào bảng đấu dễ hơn, khi không chung bảng với Việt Nam và Indonesia tại ASEAN Cup 2026.",0,0.9456178635911242,3,21
VNExpress,Đình Bắc: 'Tôi không thể di chuyển bình thường',"Arab SaudiTiền đạo Nguyễn Đình Bắc phải nén đau thi đấu trong ba trận gần nhất, khi Việt Nam vào bán kết U23 châu Á 2026.",1,0.9524118280540596,3,18
VNExpress,Arteta: 'Sự ổn định có thể đưa Arsenal tới mùa giải đặc biệt',"AnhHLV Mikel Arteta tin phong độ ổn định trong suốt mùa giải là nền tảng để Arsenal hướng đến khả năng chinh phục danh hiệu, nhất là khi còn nguyên cơ hội trên cả ...",1,0.9423278369068484,0,27
VNExpress,Guardiola thận trọng vì ít thông tin về Carrick,"AnhTrước trận derby Manchester ở vòng 22 Ngoại hạng Anh, HLV Pep Guardiola thừa nhận không biết Man Utd sẽ vận hành thế nào dưới thời Michael Carrick.",2,0.942140651389046,0,21
VNExpress,Carrick phớt lờ chỉ trích từ Roy Keane,"AnhHLV Michael Carrick không bận tâm tới những công kích cá nhân từ cựu đội trưởng Roy Keane, mà chỉ tập trung giúp Man Utd giành kết quả tốt trong trận ra mắt ...",4,0.9420109505207508,0,25
VNExpress,Tân HLV Real: 'Mọi chuyện trên sân là trách nhiệm của tôi',"Tây Ban NhaHLV Alvaro Arbeloa bảo vệ các cầu thủ và kêu gọi người hâm mộ ủng hộ, trước trận Real Madrid gặp Levante ở vòng 20 La Liga.",2,0.9095633178492494,0,22
VNExpress,Báo Thái Lan: 'U23 Việt Nam có trái tim sư tử',Truyền thông Thái Lan và Indonesia đều khen ngợi màn trình diễn của Việt Nam trong trận thắng UAE 3-2 ở tứ kết U23 châu Á 2026.,1,0.9332309783449928,3,18
VNExpress,HLV Kim: 'Trận thắng UAE tái khẳng định Việt Nam vươn tầm châu Á',"Arab SaudiHLV Kim Sang-sik hãnh diện khi Việt Nam thắng UAE 3-2 ở tứ kết, và tiếp tục hướng tới mục tiêu vào chung kết U23 châu Á 2026.",1,0.9617773353436613,3,18
VNExpress,HLV của UAE: 'Chúng tôi về nước trong thanh thản',"Arab SaudiHLV Marcelo Broli không cảm thấy hối tiếc sau khi UAE thua Việt Nam 2-3 ở tứ kết U23 châu Á 2026, tối 16/1.",1,0.9109026325537227,3,16
VNExpress,U23 Việt Nam thắng trận chính thức thứ 15 liên tiếp,"Arab SaudiHLV Kim Sang-sik giúp U23 Việt Nam nối dài mạch thắng kỷ lục lên 15 trận chính thức, sau khi hạ UAE ở tứ kết U23 châu Á 2026.",1,0.9498935104898456,3,20
VNExpress,Hậu vệ Việt Nam phá dớp 'chiếc áo số 21' ở U23 châu Á,"Arab SaudiTrước Phạm Minh Phúc - tác giả bàn ấn định 3-2 trước UAE ở tứ kết tối 16/1, đã có ba cầu thủ mang áo số 21 của Việt Nam bị đuổi ở ba giải U23 châu Á gần nhất.",1,0.8627566340471164,3,27
