source,title,content,dominant_topic,topic_probability,kmeans_cluster,word_count
VietnamNet,Văn kiện Đại hội Đảng: Đặt bình đẳng ở vị trí trung tâm của đại đoàn kết dân tộc,Văn kiện Đại hội Đảng: Đặt bình đẳng ở vị trí trung tâm của đại đoàn kết dân tộc,3,0.5608953568862522,3,10
VietnamNet,"Sửa đổi Luật Tín ngưỡng, tôn giáo phải bảo đảm tính hài hòa, phù hợp","Sửa đổi Luật Tín ngưỡng, tôn giáo phải bảo đảm tính hài hòa, phù hợp",3,0.5479575762615752,4,8
VietnamNet,Kỳ vọng của đồng bào dân tộc thiểu số trước thềm Đại hội 14 của Đảng,Kỳ vọng của đồng bào dân tộc thiểu số trước thềm Đại hội 14 của Đảng,3,0.8980833108417137,3,9
VietnamNet,"Bộ trưởng Đào Ngọc Dung: Năm 2026 tăng tốc mạnh mẽ, 'làm 1 ngày nghĩ cho 10 năm'","Bộ trưởng Đào Ngọc Dung: Năm 2026 tăng tốc mạnh mẽ, 'làm 1 ngày nghĩ cho 10 năm'",1,0.3821174840092658,3,11
VietnamNet,Người trẻ vùng cao Quảng Ngãi đưa bản sắc dân tộc lên không gian số,Người trẻ vùng cao Quảng Ngãi đưa bản sắc dân tộc lên không gian số,1,0.49211421253238363,4,10
VietnamNet,"Nhiệm kỳ Đại hội XIII: Giảm nghèo bền vững, lấy con người làm trung tâm","Nhiệm kỳ Đại hội XIII: Giảm nghèo bền vững, lấy con người làm trung tâm",3,0.3777858682283166,3,9
VietnamNet,Thứ trưởng Y Vinh Tơr: Đầu tư trường dự bị đại học là đầu tư cho tương lai,Thứ trưởng Y Vinh Tơr: Đầu tư trường dự bị đại học là đầu tư cho tương lai,3,0.9101497405382941,3,10
VietnamNet,Thứ trưởng Y Thông dự lễ khởi công dự án đầu tư cơ sở vật chất cho Trường Dự bị đại học Sầm Sơn,Thứ trưởng Y Thông dự lễ khởi công dự án đầu tư cơ sở vật chất cho Trường Dự bị đại học Sầm Sơn,3,0.7897788508320949,3,15
VietnamNet,"Những mái trường được xây dựng ở vùng DTTS là công trình của tình dân tộc, nghĩa đồng bào","Những mái trường được xây dựng ở vùng DTTS là công trình của tình dân tộc, nghĩa đồng bào",4,0.5434730794896062,3,15
VietnamNet,Khai mở sinh kế bền vững từ văn hóa Tây Nguyên,Khai mở sinh kế bền vững từ văn hóa Tây Nguyên,2,0.6934235027007903,0,7
VietnamNet,Ban Thường vụ Đảng ủy Bộ Dân tộc và Tôn giáo làm việc với Ban Tôn giáo Chính phủ,Ban Thường vụ Đảng ủy Bộ Dân tộc và Tôn giáo làm việc với Ban Tôn giáo Chính phủ,2,0.9377787569164238,3,12
VietnamNet,Từ chỉ đạo của Tổng Bí thư đến chiến lược phát triển nguồn nhân lực vùng đồng bào DTTS,Từ chỉ đạo của Tổng Bí thư đến chiến lược phát triển nguồn nhân lực vùng đồng bào DTTS,2,0.9377062980265777,0,12
VietnamNet,Chương trình Mục tiêu quốc gia: Tạo sinh kế cho đồng bào Khmer vùng Bảy Núi,Chương trình Mục tiêu quốc gia: Tạo sinh kế cho đồng bào Khmer vùng Bảy Núi,4,0.558055404790572,3,11
VietnamNet,Chữ Thái Lai Tay và hành trình trở thành di sản văn hóa phi vật thể quốc gia,Chữ Thái Lai Tay và hành trình trở thành di sản văn hóa phi vật thể quốc gia,2,0.884024643496158,3,10
VietnamNet,Giữ gìn bản sắc văn hóa từ việc dạy tiếng Ê Đê trong trường học,Giữ gìn bản sắc văn hóa từ việc dạy tiếng Ê Đê trong trường học,3,0.6531761508689949,0,10
VietnamNet,'Cầu nối' đưa chính sách vào đời sống làm đổi thay những bản làng nghèo,'Cầu nối' đưa chính sách vào đời sống làm đổi thay những bản làng nghèo,3,0.46403338851252945,2,10
VietnamNet,"Biến đất sỏi đá thành vùng quả ngọt, nông dân Hrê cùng nhau thoát nghèo","Biến đất sỏi đá thành vùng quả ngọt, nông dân Hrê cùng nhau thoát nghèo",4,0.5013886808578565,0,14
VietnamNet,"TPHCM tổ chức hội nghị tổng kết công tác dân tộc, tín ngưỡng và tôn giáo","TPHCM tổ chức hội nghị tổng kết công tác dân tộc, tín ngưỡng và tôn giáo",2,0.899632234239499,3,9
VietnamNet,Vàng Thị Dế - Cô gái mang vải lanh truyền thống của người Mông ra thế giới,Vàng Thị Dế - Cô gái mang vải lanh truyền thống của người Mông ra thế giới,0,0.9377408481980244,4,12
VietnamNet,"Kết luận của Tổng Bí thư tại buổi gặp mặt học sinh, sinh viên DTTS xuất sắc","Kết luận của Tổng Bí thư tại buổi gặp mặt học sinh, sinh viên DTTS xuất sắc",4,0.7095239483943804,0,10
VietnamNet,Bà con vùng lũ Đắk Lắk nhận nhà mới từ 'Chiến dịch Quang Trung',Bà con vùng lũ Đắk Lắk nhận nhà mới từ 'Chiến dịch Quang Trung',4,0.9193850011373484,0,11
VietnamNet,“Đánh thức” tiếng đàn Sèn Dư của đồng bào Cờ Lao,“Đánh thức” tiếng đàn Sèn Dư của đồng bào Cờ Lao,0,0.8375350971646683,3,8
VietnamNet,Mùa hoa mận Mộc Châu: Sắc trắng cao nguyên níu tim người,Mùa hoa mận Mộc Châu: Sắc trắng cao nguyên níu tim người,1,0.5999365546783791,4,9
VietnamNet,"Tổng Bí thư: Nghiên cứu cấp học bổng đào tạo ở nước ngoài cho học sinh, sinh viên DTTS xuất sắc","Tổng Bí thư: Nghiên cứu cấp học bổng đào tạo ở nước ngoài cho học sinh, sinh viên DTTS xuất sắc",4,0.9373433718676314,3,12
VietnamNet,Cô gái Ba Na giữ văn hóa dân tộc bằng từ điển số,Cô gái Ba Na giữ văn hóa dân tộc bằng từ điển số,0,0.6881490376915809,3,9
VietnamNet,"Nghệ nhân hơn 100 tuổi giữ ""lửa"" văn hóa truyền thống của người Ba Na","Nghệ nhân hơn 100 tuổi giữ ""lửa"" văn hóa truyền thống của người Ba Na",0,0.8023562289094889,0,11
VietnamNet,Sơn La dừng phương án thi lớp 10 năm 2026 bằng tổ hợp 6 môn,Sơn La dừng phương án thi lớp 10 năm 2026 bằng tổ hợp 6 môn,4,0.4821832063353939,3,9
VietnamNet,"Thêm nhiều tỉnh, thành công bố môn thi thứ 3 vào lớp 10 năm nay","Thêm nhiều tỉnh, thành công bố môn thi thứ 3 vào lớp 10 năm nay",3,0.6128328848481115,3,11
VietnamNet,Việt Nam cần đặt mục tiêu có 1 đại học lọt top 20 đến 50 thế giới,Việt Nam cần đặt mục tiêu có 1 đại học lọt top 20 đến 50 thế giới,1,0.6527045920558533,2,9
VietnamNet,Tổng Bí thư nào từng nói 'cho em để chức vị bên ngoài cánh cổng trường',Tổng Bí thư nào từng nói 'cho em để chức vị bên ngoài cánh cổng trường',0,0.6995888397123927,3,13
VietnamNet,Trường ĐH Thương mại công bố 4 phương thức tuyển sinh năm 2026,Trường ĐH Thương mại công bố 4 phương thức tuyển sinh năm 2026,3,0.9195966503057031,3,7
VietnamNet,"Một trường đại học chi hơn 1,5 tỷ đồng lì xì Tết sớm cho sinh viên","Một trường đại học chi hơn 1,5 tỷ đồng lì xì Tết sớm cho sinh viên",3,0.9493757440904051,4,12
VietnamNet,Nữ sinh đứng hạng nhất lớp bị phạt tù treo trong vụ đề thi bị trộm giữa đêm,Nữ sinh đứng hạng nhất lớp bị phạt tù treo trong vụ đề thi bị trộm giữa đêm,4,0.9326326665766186,3,15
VietnamNet,"Tuyển sinh lớp 10 TPHCM 2026 có 4 trường THPT chuyên, 2 trường rất nổi tiếng","Tuyển sinh lớp 10 TPHCM 2026 có 4 trường THPT chuyên, 2 trường rất nổi tiếng",1,0.8980005359936264,3,9
VietnamNet,Công bố đề tham khảo thi Đánh giá năng lực của Trường ĐH Sư phạm Hà Nội năm 2026,Công bố đề tham khảo thi Đánh giá năng lực của Trường ĐH Sư phạm Hà Nội năm 2026,3,0.9462073240223785,3,12
VietnamNet,Lịch nghỉ Tết Âm lịch 2026 của học sinh TPHCM mới nhất,Lịch nghỉ Tết Âm lịch 2026 của học sinh TPHCM mới nhất,3,0.9266113043736735,3,8
VietnamNet,"Tổng Bí thư nào quê Bắc Ninh, được bầu khi mới 26 tuổi?","Tổng Bí thư nào quê Bắc Ninh, được bầu khi mới 26 tuổi?",0,0.5714866750647515,3,9
VietnamNet,"VinUni tăng tốc thu hút nhân tài, chuyển dịch lên mô hình đại học nghiên cứu","VinUni tăng tốc thu hút nhân tài, chuyển dịch lên mô hình đại học nghiên cứu",3,0.5253276063449916,3,9
VietnamNet,"Nhiều đại học phía Nam công bố tuyển sinh 2026, quay lại xét tuyển học bạ","Nhiều đại học phía Nam công bố tuyển sinh 2026, quay lại xét tuyển học bạ",1,0.5455372583070345,0,10
VietnamNet,"ĐH Công nghiệp Hà Nội tuyển sinh 8.300 chỉ tiêu, mở 4 chương trình đào tạo mới","ĐH Công nghiệp Hà Nội tuyển sinh 8.300 chỉ tiêu, mở 4 chương trình đào tạo mới",3,0.9103723675608286,3,9
VietnamNet,Học cử nhân quốc tế Đại học Keuka tại UEF - Du học Mỹ ‘không cần Visa’,Học cử nhân quốc tế Đại học Keuka tại UEF - Du học Mỹ ‘không cần Visa’,1,0.6938189070214921,2,12
VietnamNet,"Trường ĐH xây dựng nền tảng số hỗ trợ quản lý học sinh, thí điểm ở Hà Nội","Trường ĐH xây dựng nền tảng số hỗ trợ quản lý học sinh, thí điểm ở Hà Nội",3,0.9259898741674699,3,11
VietnamNet,Giáo sư tài chính bị rút 12 bài báo khỏi các tạp chí do chính mình biên tập,Giáo sư tài chính bị rút 12 bài báo khỏi các tạp chí do chính mình biên tập,0,0.5149425726196754,3,13
VietnamNet,"Lịch nghỉ Tết âm lịch 2026 của học sinh các tỉnh, thành cả nước","Lịch nghỉ Tết âm lịch 2026 của học sinh các tỉnh, thành cả nước",3,0.926744515254905,3,9
VietnamNet,Thầy giáo chỉ ra vì sao nhiều cha mẹ dạy con học sai cách,Thầy giáo chỉ ra vì sao nhiều cha mẹ dạy con học sai cách,1,0.7332374414517119,0,11
VietnamNet,Top những ngành giúp sinh viên Việt Nam tăng cơ hội định cư ở Australia,Top những ngành giúp sinh viên Việt Nam tăng cơ hội định cư ở Australia,3,0.7352467264806735,2,11
VietnamNet,Trường ĐH Giao thông vận tải bỏ phương thức xét tuyển chỉ bằng học bạ năm 2026,Trường ĐH Giao thông vận tải bỏ phương thức xét tuyển chỉ bằng học bạ năm 2026,1,0.603707596761617,3,11
VietnamNet,Giám đốc Sở KH-CN Hà Nội Trần Anh Tuấn làm Phó hiệu trưởng Trường ĐH Thủ đô,Giám đốc Sở KH-CN Hà Nội Trần Anh Tuấn làm Phó hiệu trưởng Trường ĐH Thủ đô,3,0.6645584980463796,3,13
VietnamNet,PGS.TS Nguyễn Văn Hiền làm Giám đốc Sở GD-ĐT Hà Nội,PGS.TS Nguyễn Văn Hiền làm Giám đốc Sở GD-ĐT Hà Nội,3,0.5954426774313568,3,7
VietnamNet,"Khi trường công nghệ đào tạo bác sĩ, an toàn người bệnh phải đặt lên hàng đầu","Khi trường công nghệ đào tạo bác sĩ, an toàn người bệnh phải đặt lên hàng đầu",3,0.6055808319609981,3,11
VietnamNet,Trường ĐH Sư phạm Hà Nội công bố phương thức tuyển sinh năm 2026,Trường ĐH Sư phạm Hà Nội công bố phương thức tuyển sinh năm 2026,3,0.938285287979534,3,8
VietnamNet,Trường ĐH Sư phạm Hà Nội bổ nhiệm loạt cán bộ quản lý,Trường ĐH Sư phạm Hà Nội bổ nhiệm loạt cán bộ quản lý,3,0.8004040112613648,3,8
VietnamNet,"Trường Quốc tế Mỹ bị giải thể, 'ngôi trường con nhà giàu' chính thức biến mất","Trường Quốc tế Mỹ bị giải thể, 'ngôi trường con nhà giàu' chính thức biến mất",3,0.9460082438855856,3,13
VietnamNet,Kỳ họp Quốc hội nào chỉ kéo dài 4 giờ nhưng quyết định vận mệnh đất nước?,Kỳ họp Quốc hội nào chỉ kéo dài 4 giờ nhưng quyết định vận mệnh đất nước?,1,0.7718215623844835,3,11
VietnamNet,Là con gái nên chọn học những ngành kỹ thuật nào?,Là con gái nên chọn học những ngành kỹ thuật nào?,1,0.6924399244797644,3,10
VietnamNet,Một trường quốc tế tại TPHCM bị giải thể,Một trường quốc tế tại TPHCM bị giải thể,3,0.6557778950440176,3,7
VietnamNet,Nghệ An công bố 3 môn thi tuyển sinh lớp 10 năm học 2026-2027,Nghệ An công bố 3 môn thi tuyển sinh lớp 10 năm học 2026-2027,3,0.8388654485742623,3,6
VietnamNet,Tỷ lệ tín nhiệm của người Mỹ dành cho ông Trump sụt giảm mạnh,Tỷ lệ tín nhiệm của người Mỹ dành cho ông Trump sụt giảm mạnh,2,0.5033304186824231,3,11
VietnamNet,Quốc gia thay Mỹ cung cấp phần lớn tin tình báo cho Ukraine,Quốc gia thay Mỹ cung cấp phần lớn tin tình báo cho Ukraine,4,0.8969486289182643,3,9
VietnamNet,"Nga phá cầu vượt sông của Ukraine ở Kharkiv, Kiev nhận thêm MiG-29 từ Ba Lan","Nga phá cầu vượt sông của Ukraine ở Kharkiv, Kiev nhận thêm MiG-29 từ Ba Lan",0,0.9259168512890221,0,15
VietnamNet,Cựu Tổng thống Hàn Quốc Yoon Suk-yeol bị kết án 5 năm tù giam,Cựu Tổng thống Hàn Quốc Yoon Suk-yeol bị kết án 5 năm tù giam,3,0.5951370340916017,3,9
VietnamNet,Tổng thống Macron cảnh báo Pháp nằm trong tầm bắn của tên lửa Nga,Tổng thống Macron cảnh báo Pháp nằm trong tầm bắn của tên lửa Nga,4,0.5411504189367005,3,11
VietnamNet,Ông Trump tuyên bố thành lập Hội đồng Hòa bình Dải Gaza,Ông Trump tuyên bố thành lập Hội đồng Hòa bình Dải Gaza,4,0.8651585090139109,3,9
VietnamNet,Tổng thống Nga Putin đưa ra cảnh báo về tình hình thế giới,Tổng thống Nga Putin đưa ra cảnh báo về tình hình thế giới,0,0.8983924962815135,3,9
VietnamNet,Ông Zelensky phân trần khi bị ông Trump tố 'làm chậm tiến trình hòa đàm',Ông Zelensky phân trần khi bị ông Trump tố 'làm chậm tiến trình hòa đàm',1,0.8832280880093344,3,11
VietnamNet,Lộ diện nhóm quốc gia giúp Mỹ và Iran hạ nhiệt căng thẳng,Lộ diện nhóm quốc gia giúp Mỹ và Iran hạ nhiệt căng thẳng,1,0.48783740429256994,3,10
VietnamNet,Mỹ lên tiếng khi các nước châu Âu đưa quân tới Greenland,Mỹ lên tiếng khi các nước châu Âu đưa quân tới Greenland,0,0.9265869710051895,3,10
VietnamNet,Nhóm tác chiến tàu sân bay Mỹ đến Trung Đông giữa căng thẳng với Iran,Nhóm tác chiến tàu sân bay Mỹ đến Trung Đông giữa căng thẳng với Iran,1,0.4730610450441501,3,11
VietnamNet,Tân Bộ trưởng Quốc phòng Ukraine hé lộ quy mô khủng hoảng nhân lực,Tân Bộ trưởng Quốc phòng Ukraine hé lộ quy mô khủng hoảng nhân lực,2,0.8988360504604136,3,9
VietnamNet,Mỹ bắt thêm tàu chở dầu tình nghi vi phạm lệnh trừng phạt Venezuela,Mỹ bắt thêm tàu chở dầu tình nghi vi phạm lệnh trừng phạt Venezuela,3,0.6401090849291972,3,11
VietnamNet,"Mỹ áp trừng phạt Tehran, các nước Vùng Vịnh cảnh báo hậu quả tấn công Iran","Mỹ áp trừng phạt Tehran, các nước Vùng Vịnh cảnh báo hậu quả tấn công Iran",1,0.5801628162452868,3,11
VietnamNet,Lãnh đạo phe đối lập Venezuela tặng ông Trump huy chương Nobel hòa bình,Lãnh đạo phe đối lập Venezuela tặng ông Trump huy chương Nobel hòa bình,4,0.8991296287580629,3,11
VietnamNet,Cô gái sẽ trở thành Nữ hoàng Tây Ban Nha đầu tiên trong 150 năm,Cô gái sẽ trở thành Nữ hoàng Tây Ban Nha đầu tiên trong 150 năm,3,0.9312413108972593,3,10
VietnamNet,Khoảnh khắc Nga dội bom FAB-3000 vào căn cứ Ukraine ở mặt trận Kupiansk,Khoảnh khắc Nga dội bom FAB-3000 vào căn cứ Ukraine ở mặt trận Kupiansk,0,0.6284288943864103,2,11
VietnamNet,"Ukraine thừa nhận mặt trận phía nam cam go, tự tin sẽ vượt qua Nga năm 2026","Ukraine thừa nhận mặt trận phía nam cam go, tự tin sẽ vượt qua Nga năm 2026",0,0.8067097244962984,3,12
VietnamNet,"HĐBA họp khẩn về Iran, ông Trump rút lại đe dọa tấn công Tehran","HĐBA họp khẩn về Iran, ông Trump rút lại đe dọa tấn công Tehran",1,0.47570974436488744,3,13
VietnamNet,London nói về việc đáp trả vụ Nga trục xuất nhân viên ngoại giao Anh,London nói về việc đáp trả vụ Nga trục xuất nhân viên ngoại giao Anh,0,0.5623621175517046,3,12
VietnamNet,"Tổng tham mưu trưởng Nga thị sát tiền tuyến, Ukraine có bộ trưởng quốc phòng mới","Tổng tham mưu trưởng Nga thị sát tiền tuyến, Ukraine có bộ trưởng quốc phòng mới",0,0.6023268525087234,3,9
VietnamNet,Ông Trump nói về cuộc điện đàm ‘tuyệt vời’ với Tổng thống lâm thời Venezuela,Ông Trump nói về cuộc điện đàm ‘tuyệt vời’ với Tổng thống lâm thời Venezuela,4,0.649513927684603,3,11
VietnamNet,Ngoại trưởng Iran làm rõ số người thiệt mạng trong các cuộc biểu tình,Ngoại trưởng Iran làm rõ số người thiệt mạng trong các cuộc biểu tình,0,0.9191999984790039,4,11
VietnamNet,Chỉ 9% người Mỹ ủng hộ ông Trump thâu tóm Greenland bằng vũ lực,Chỉ 9% người Mỹ ủng hộ ông Trump thâu tóm Greenland bằng vũ lực,1,0.9187941671256723,4,10
VietnamNet,"Tehran đóng cửa không phận, rộ tin Mỹ sắp tấn công Iran","Tehran đóng cửa không phận, rộ tin Mỹ sắp tấn công Iran",1,0.8992662476714723,3,9
VietnamNet,"Nga sẵn sàng tiếp xúc với Mỹ, Ukraine ban bố tình trạng khẩn cấp về năng lượng","Nga sẵn sàng tiếp xúc với Mỹ, Ukraine ban bố tình trạng khẩn cấp về năng lượng",0,0.8848398678181281,3,10
VietnamNet,Đan Mạch và Mỹ vẫn còn 'bất đồng cơ bản' về Greenland,Đan Mạch và Mỹ vẫn còn 'bất đồng cơ bản' về Greenland,0,0.884374715093375,3,9
VietnamNet,Các cuộc khủng hoảng lớn ở Iran trong hơn 40 năm qua,Các cuộc khủng hoảng lớn ở Iran trong hơn 40 năm qua,0,0.5962220160791781,3,10
VietnamNet,Video pháo phản lực 'Cuồng phong' Nga bắn phá nhiều mục tiêu Ukraine ở Pokrovsk,Video pháo phản lực 'Cuồng phong' Nga bắn phá nhiều mục tiêu Ukraine ở Pokrovsk,0,0.8661920307093723,0,11
VietnamNet,Mỹ yêu cầu nhân viên rời khỏi căn cứ không quân ở Qatar sau cảnh báo của Iran,Mỹ yêu cầu nhân viên rời khỏi căn cứ không quân ở Qatar sau cảnh báo của Iran,0,0.9184713758238233,3,13
VietnamNet,"Ukraine nói châu Âu hỗ trợ quân sự quá chậm, Nga kiểm soát thêm làng ở Sumy","Ukraine nói châu Âu hỗ trợ quân sự quá chậm, Nga kiểm soát thêm làng ở Sumy",0,0.7482433849886443,3,13
VietnamNet,Điều day dứt nhất cuộc đời của nữ MC 'nói tiếng Anh như gió' đang làm ở VTV,Điều day dứt nhất cuộc đời của nữ MC 'nói tiếng Anh như gió' đang làm ở VTV,3,0.945367059193272,3,16
VietnamNet,"Lời nhắn của Chí Trung gửi tới 'Ngọc hoàng' Quốc Khánh, NSND Thu Quế trẻ trung","Lời nhắn của Chí Trung gửi tới 'Ngọc hoàng' Quốc Khánh, NSND Thu Quế trẻ trung",4,0.86210214475638,3,11
VietnamNet,Phía ca sĩ Phương Mỹ Chi phủ nhận thông tin 'sử dụng chất cấm',Phía ca sĩ Phương Mỹ Chi phủ nhận thông tin 'sử dụng chất cấm',0,0.9199132942650424,3,9
VietnamNet,'Ngọc nữ' Phương Anh Đào khẳng định diễn viên Tuấn Trần chỉ là bạn thân,'Ngọc nữ' Phương Anh Đào khẳng định diễn viên Tuấn Trần chỉ là bạn thân,3,0.6644864817004886,4,11
VietnamNet,Cuộc đời không ồn ào của ca sĩ Thái Thảo - người vừa ly hôn danh ca Tuấn Ngọc,Cuộc đời không ồn ào của ca sĩ Thái Thảo - người vừa ly hôn danh ca Tuấn Ngọc,3,0.925957827967721,4,12
VietnamNet,'Lằn ranh' tập 54: Phó bí thư phải xuống nước khi người tình tìm đến tận nhà,'Lằn ranh' tập 54: Phó bí thư phải xuống nước khi người tình tìm đến tận nhà,2,0.6005168621396962,3,12
VietnamNet,Lời ngọt ngào danh ca Tuấn Ngọc dành cho vợ kém 14 tuổi trước khi ly hôn,Lời ngọt ngào danh ca Tuấn Ngọc dành cho vợ kém 14 tuổi trước khi ly hôn,0,0.5098455132008985,3,12
VietnamNet,Diva Hồng Nhung khoe tin vui,Diva Hồng Nhung khoe tin vui,0,0.2,3,4
VietnamNet,'Cách em 1 milimet' tập 40: Bí mật của Chiến Đo bị cả nhóm phanh phui,'Cách em 1 milimet' tập 40: Bí mật của Chiến Đo bị cả nhóm phanh phui,3,0.8981870317291302,3,10
VietnamNet,NSND Tống Toàn Thắng nhận bằng khen của Bộ trưởng Bộ Văn hóa,NSND Tống Toàn Thắng nhận bằng khen của Bộ trưởng Bộ Văn hóa,2,0.5929347328266212,3,10
VietnamNet,Ra mắt sách 'Ngành Tuyên giáo và Dân vận trong nhiệm kỳ Đại hội 13 của Đảng',Ra mắt sách 'Ngành Tuyên giáo và Dân vận trong nhiệm kỳ Đại hội 13 của Đảng',3,0.9463056034688867,3,11
VietnamNet,Danh ca Tuấn Ngọc ly hôn ở tuổi 78,Danh ca Tuấn Ngọc ly hôn ở tuổi 78,3,0.6395264416360705,3,6
VietnamNet,Ngôi chùa cổ trong hang động từng là nơi sản xuất vũ khí trong chiến tranh,Ngôi chùa cổ trong hang động từng là nơi sản xuất vũ khí trong chiến tranh,3,0.7671688995661363,3,12
VietnamNet,Khoản tiền 700 triệu được giữ hàng chục năm của NSND Phùng Há giờ ra sao?,Khoản tiền 700 triệu được giữ hàng chục năm của NSND Phùng Há giờ ra sao?,3,0.48315923420636253,4,13
VietnamNet,Cánh diều vàng 2025 gọi tên Mạnh Trường và Thượng tá Đặng Thái Huyền 'Mưa đỏ',Cánh diều vàng 2025 gọi tên Mạnh Trường và Thượng tá Đặng Thái Huyền 'Mưa đỏ',4,0.5067189498474886,3,11
VietnamNet,"Rapper Karik: 'Ca sĩ ảo đi diễn thế nào, có đọc rap được không?'","Rapper Karik: 'Ca sĩ ảo đi diễn thế nào, có đọc rap được không?'",0,0.4364065335305191,3,12
VietnamNet,NSƯT Kim Xuyến tuổi 81: Con dâu không cho rửa bát vì sợ bẩn,NSƯT Kim Xuyến tuổi 81: Con dâu không cho rửa bát vì sợ bẩn,0,0.6283888244426367,3,11
VietnamNet,"Cục trưởng Xuân Bắc 'làm đẹp' cho NSND Tự Long, Mỹ Tâm mừng sinh nhật tuổi 45","Cục trưởng Xuân Bắc 'làm đẹp' cho NSND Tự Long, Mỹ Tâm mừng sinh nhật tuổi 45",2,0.6107025210233299,3,12
VietnamNet,"Từ ồn ào của Lệ Quyên, Sở Văn hóa đề nghị nghệ sĩ ứng xử văn minh với khán giả","Từ ồn ào của Lệ Quyên, Sở Văn hóa đề nghị nghệ sĩ ứng xử văn minh với khán giả",3,0.594389388696692,0,12
VietnamNet,'Cách em 1 milimet' tập 39: Nghiêm lên kế hoạch gài bẫy Ngân và Viễn,'Cách em 1 milimet' tập 39: Nghiêm lên kế hoạch gài bẫy Ngân và Viễn,3,0.8843382456123257,3,11
VietnamNet,"Tùng Dương, Mỹ Tâm sẽ tham gia concert 50 nghìn khán giả tại Quảng Ninh","Tùng Dương, Mỹ Tâm sẽ tham gia concert 50 nghìn khán giả tại Quảng Ninh",4,0.8845013775208692,0,9
VietnamNet,'Lằn ranh' tập 53: Người tình của Khắc quỳ gối xin Viện phó Viện kiểm sát giảm án,'Lằn ranh' tập 53: Người tình của Khắc quỳ gối xin Viện phó Viện kiểm sát giảm án,2,0.9108331800161589,3,12
VietnamNet,"Lên cơn co giật trên sóng truyền hình, nam diễn viên 48 tuổi nhập viện cấp cứu","Lên cơn co giật trên sóng truyền hình, nam diễn viên 48 tuổi nhập viện cấp cứu",0,0.8850585921742244,3,10
VietnamNet,Nữ MC của VTV nước mắt giàn giụa tiết lộ tình trạng sức khoẻ sa sút,Nữ MC của VTV nước mắt giàn giụa tiết lộ tình trạng sức khoẻ sa sút,2,0.8847821297360983,3,11
VietnamNet,Nhã Phương - Trường Giang: Ngọt ngào như thuở mới yêu,Nhã Phương - Trường Giang: Ngọt ngào như thuở mới yêu,0,0.7982245124424432,3,8
VietnamNet,"Phó giáo sư Tân Nhàn trẻ trung ở tuổi 44, Việt Hương thân mật với trai trẻ","Phó giáo sư Tân Nhàn trẻ trung ở tuổi 44, Việt Hương thân mật với trai trẻ",0,0.5110689099724272,3,10
VietnamNet,Diễn viên phim '24 giờ' bị bắt vì hành hung tài xế xe công nghệ,Diễn viên phim '24 giờ' bị bắt vì hành hung tài xế xe công nghệ,3,0.919506417270296,3,10
VietnamNet,Sở Văn hóa TPHCM vào cuộc vụ ca sĩ Lệ Quyên phát ngôn thô tục,Sở Văn hóa TPHCM vào cuộc vụ ca sĩ Lệ Quyên phát ngôn thô tục,2,0.8663479101906019,3,8
VietnamNet,Lan tỏa di sản Việt Nam trong không gian hội họa giàu chất thơ,Lan tỏa di sản Việt Nam trong không gian hội họa giàu chất thơ,0,0.8992785561163011,2,11
VietnamNet,Ca sĩ Long Nhật bị thương vẫn cố gắng hoàn thành vai diễn,Ca sĩ Long Nhật bị thương vẫn cố gắng hoàn thành vai diễn,0,0.799433432847349,3,8
VietnamNet,"Một hoa hậu qua đời đột ngột ở tuổi 22, người hâm mộ bàng hoàng","Một hoa hậu qua đời đột ngột ở tuổi 22, người hâm mộ bàng hoàng",0,0.7973679190838217,4,9
